Title,First Paragraph
Patricia Neal,"<START> Ni Patricia Neal ket maysa idi nga Amerikana nga aktres iti entablado ken pelikula. Isu ket kaaduan nga ammo para kadagiti papelna iti pelikula a kas ni Helen Benson ti balo a babai ti Gubat ti Sangalubongan II iti The Day the Earth Stood Still (1951), kas ni Emily Eustace Failenson iti Breakfast at Tiffany's (1961), ken kas ni Alma Brown iti Hud (1963), ken nangabakanna daytoy iti Kalaingan nga Aktres. Inladawanna ni Olivia Walton iti pelikula ti telebision idi 1971 iti The Homecoming: A Christmas Story, ti papel nga inladawan iti kadawyan a serye babaen ni Michael Learned. <END>"
Henry Fonda,<START> Ni Henry Jaynes 'Hank' Fonda ket maysa idi nga Amerikano nga aktor iti pelikula ken entablado a nagpaut iti karerna kadagiti ad-adu ngem lima a dekada. <END>
George Bernard Shaw,"<START> Ni George Bernard Shaw ket maysa idi nga Irlandes a dramaturgo ken ti kimmaduaan a nangbangon ti Pagadalan ti Ekonomia ti Londres. Urayno ti immuna a nagganansia a panagsuratna idi ket ti musika ken literario a kritisismo, nga iti kapasidad ket nagsurat kadagiti adu a nangato ti artikulona a paset ti panagsursurat, ti kangrunaan a kalaingna idi ket para iti drama, ket isu ket nagsursurat kadagiti ad-adu ngem 60 a pabuya. Gangani amin nga insursuratna ket mangibagbaga kadagiti sosial a parikut, ngem adda dagiti tinaudanna iti komedia a makaaramid a maibturan gapo ti nainget a tema. Ni Shaw nagsukimat ti edukasion, panagasaw, relihion, gobierno, panagaywan ti salun-at, ken ti pribilehio ti klase. <END>"
Yun Chi-ho,<START> Ni Yun Chi-ho maysa idi a nangruna nga aktibista iti politika iti las-ud dagiti naladaw a tawen ti 1800 ken dagiti nasapa a tawen ti 1900 iti Joseon a Korea. <END>
Robert Johnson,"<START> Ni Robert Leroy Johnson ket maysa idi nga Amerikano a kumakanta-mannurat iti kanta ken musikero iti blues. Dagiti nangruna a rekordna idi 1936 ken 1937 ket mangiparang iti talento a kombinasion iti panagkanta, kalaing iti panaggitara, ken panagsurat iti kanta a nakaimpluensia kadagiti simmaruno a kaputotan dagiti musikero. Ti saan unay a nadokumentuan a biag ni Johnson ken ti ipupusay idi agtawen iti 27 ket nakaited iti iyaadu iti leyendana, ken ti mairaman ti mitiko ni Fausto nga isuket nangilako iti kararuana iti demonio iti pagsasabtan tapno makagun-od iti balligi. <END>"
Judy Ann Santos,"<START> Ni Judy Ann Santos-Agoncillo ket Filipina nga aktres ti pelikula ken telebision, mangsangsangaili, agitaltal-o iti produkto, ken produser ti pelikula. <END>"
Angel Locsin,"<START> Ni Angel Locsin ket maysa nga artista, modelo ken aktres manipud idiay Filipinas. <END>"
Maya Angelou,"<START> Ni Maya Angelou ket Amerikana a mannurat, mannaniw, sumasala, aktres, ken kumakanta. Isu ket nakaipablaak kadagiti pito nga autobiograpia, dagiti tallo a libro ti salaysay, ken dagiti nadumaduma a libro ti daniw, ken naipammadayawan iti listaan dagiti drama, dagiti pabuya iti sine, ken telebision kadagiti sumurok a 50 a tawen. Isu ket nakaawat kadagiti sangadosena a gunguna ken dagiti ad-adu ngem 50 a pammadayaw a grado. <END>"
Al Gore,"<START> Ni Albert Arnold 'Al' Gore, Jr. ket nagserbi a kas ti maika-45 a Bise Presidente iti Estados Unidos (1993–2001), babaen ni Presidente Bill Clinton. Isuidi ti nominadopara iti Presidente ken napaay idi 2000 panagbutos ti presidente ti Estados Unidos urayno nangbak ti nadayeg a butos. <END>"
Nick Joaquin,"<START> Kaaduan nga ammo ni Nicomedes Marquez Joaquin a kas Nick Joaquin, maysa kadagiti kalatakan ken kalaingan a Filipino a nobelista, mannalaysay, dramaturgo, mannaniw, biograpo, historiador, editor, ken agiwarwarnak. Naipasngay iti Paco, Manila. Am-ammo pay iti naganna-iti-pluma a Quijano de Manila nga ar-aramatenna kas mabigbig nga agiwarwarnak. <END>"
Josh Duhamel,<START> Ni Josh Duhamel ket maysa nga aktor iti manipud idiay Estados Unidos. <END>
Steve Jobs,"<START> Ni Steven Paul Jobs ket maysa nga Amerikano a negosiante, dumidibuho ken inbentor. <END>"
Lady Gaga,"<START> Ni Stefani Joanne Angelina Germanotta, ammo iti entablado a naganna a kas Lady Gaga, ket maysa nga Amerikana akumakanta ket mannurat ti kanta. Naipasngay ken dimmakkel idiay Siudad ti New York, isu ket nangruna anagadal idiay Kombento iti Sagrado a Puso ket nabiit a nagadal idiay Tisch a Pagadalan dagiti Arte ti Unibersidad ti New York sakbay a nagikkat tapno agipatengnga ti isipna ti karerrna ti musika. Isu ket nagrugrugi nga agpabpabuya kadagidiay mabuya a rock a musika iti Baba a Bangir ti Daya ti Manhattan, ken pinirmaan ti Streamline Records babaen idi gibus ti 2007. Idi panawen tipanagtrabahona a kas mannurat ti musika para iti kompania ti plaka, ti bosesna ket nakaala kadagiti panakaimatang ti agrerehistro nga artista ni Akon, a nagpirma kaniana ti bukodna nga etiketa ti Kon Live Distribution. <END>"
Adriano Celentano,"<START> Ni Adriano Celentano ket Italiano a kumakanta, kompositor, produser, komediante, aktor, direktor ti pelikula ken personalidad ti telebision. <END>"
Stanley Kubrick,<START> Ni Stanley Kubrick ket maysa nga Amerikano a direktor ti pelikula ken mangipupuonan a mabigbig kas maysa kadagiti kalaingan ken impluensial nga agparpartuat iti pelikula iti naladaw a maika-20 a siglo. <END>
Nur Misuari,"<START> NI Nur Misuari ket Moro a rebolusionario ken politiko, nagpundar ken daulo ti Moro National Liberation Front. <END>"
Ryu Jun-yeol,<START> Ni Ryu Jun-yeol ket taga-Abagatan a Korea nga aktor. <END>
Kate Winslet,"<START> Ni Kate Elizabeth Winslet, CBE, ket maysa nga Ingles nga aktres ken kumakanta. Isu ket nagungunaan iti maysa a Gunguna ti Akademia, maysa a Gunguna ti Emmy, uppat a Gunguna ti Nabalitokan a Globo, maysa a Gunguna ti Grammy, ken maysa a Gunguna ti AACTA, ken tallo a Gunguna ti BAFTA. Isu ti kaubingan a tao a nakaawat kadagiti lima a nominasion ti Gunguna ti Akademia iti dagup a pito, ken maysa kadagiti bassit laeng nga aktres a nangabak iti tallo kadagiti uppat a nangruna a gunguna ti panglinglingayan ti Amerika (EGOT). <END>"
Mae West,"<START> Ni Mary Jane 'Mae' West ket maysa idi nga Amerikana nga aktres, kumakanta, dramaturgo, mannurat iti senario, ken simbolo ti sekso a nagpaut iti pagsapulanna iti pagliwliwaan kadagiti pito a dekada. Para iti kontribusionna iti sinema ti Amerika, inranggo ti American Film Institute ni West a kas maika-15 kadagiti kalatakan nga artista a babai iti klasiko a sinema ti Amerika. <END>"
Brahmagupta,"<START> Ni Brahmagupta ket maysa idi nga Indiano a matematiko ken astronomo a nangisurat kadagiti dua a nangruna nga obra iti matematika ken astronomia: ti Brāhmasphuṭasiddhānta (628), ti teoretiko a treatado, ken ti Khaṇḍakhādyaka, ti nasaysayaat a kaserbi a teksto. Adda dagiti dua a rason a naipamattian a ni Brahmagupta ket nagtaud manipud idiay Bhinmal. <END>"
Spiro Agnew,"<START> Ni Spiro Theodore Agnew ket isu idi ti maika-39 a Bise Presidente iti Estados Unidos (1969–1973), a nagserbi babaen ni Presidente Richard Nixon, ken ti maika-55 a Gobernador ti Maryland (1967–1969). Isu idi ti immuna a Griego Amerikano a nagtengngel kadagitoy nga opisina. <END>"
Claudette Colbert,"<START> Ni Claudette Colbert ket maysa idi a naiyanak idiay Pransia nga Amerikana nga aktres, ken bida a babai iti pelikula iti Hollywood para kadagiti dua a dekada. <END>"
Paul Ryan,<START> Ni Paul Davis Ryan ket isu ti Pannakabagi ti Estados Unidos para iti umuna a kongresional a distrito ken ti nominado ti Partido Republikano para iti Bise Presidente ti Estados Unidos iti panagbubutos idi 2012. <END>
Charles de Gaulle,"<START> Ni Charles André Joseph Marie de Gaulle ket maysa idi a Pranses a heneral ken estadista a nangidaulo dagiti Nawaya a Puersa ti Pransia idi las-ud ti Maikadua a Sangalubongan a Gubat. Isu ket nangbangon pay ti Maikalima a Republika ti Pransia idi 1958 ken nagserbi a kas ti immuna a Presidente manipud idi 1959 aginggana idi 1969. Ti beterano ti Umuna a Sangalubongan a Gubat, kadagiti tawtawen ti 1920 ken 1930, ni de Gaulle ket immay ti puersa a kas maysa a nangipangpangruna dagiti nakuti a nakalasagan a dibision, nga inpanpanunotanna nga agbalin a sentro iti moderno a pannakigubat. Idi las-ud ti Maikadua a Sangalubongan a Gubat II, isu ket nakagun-od ti ranggo a brigadier heneral, a nangidaulo kadagiti bassit a nagballigi a nakalasagan a kontra a panagraut idi las-ud ti 1940 a Gubat ti Pransia idi Mayo iti las-ud ti Montcornet, ken nabiit a nagserbi iti gobierno ti Pransia idi matmatnag ti Pransia. Ni De Gaulle ket isu idi ti kangatuan nga opisial ti milisia ti Pransia a nanglikud ti Hunio 1940 a panagipasardeng ti gubat iti Nazi nga Alemania manipud idi naiparugi daytoy. <END>"
Frances McDormand,"<START> Ni Frances Louise McDormand ket maysa nga Amerikana nga aktres. Isu ket asawanan ni Joel Coen ti direktor ken mannurat manipud idi 1984 ken nagbidan kadagiti nadumaduma a pelikula dagiti agkabsat a Coen, mairaman ti Blood Simple (1984), Raising Arizona (1987), Fargo (1996), The Man Who Wasn't There (2001) ken ti Burn After Reading (2008). Ni McDormand ket maysa kadagiti saan unay nga adu a mangiladladawan a nakagun-od iti Tallo a Balangat iti Panagarte. Idi 1997, isu ket nangabak iti Kalaingan nga Aktres para iti Fargo. <END>"
Gregorio S. Araneta,"<START> Ni Gregorio Soriano Araneta, ammo pay a kas ni Don Gregorio S. Araneta,ket maysa idi a Filipino nga abogado, negosiante, nasionalista ken patriota, idi las-ud ti paset ti panawen dagiti kolonia ti Espaniol ken Amerikano. <END>"
Bradley Cooper,<START> Ni Bradley Charles Cooper ket aktor ken produser manipud iti Estados Unidos. <END>
Chelsea Kane,"<START> Ni Chelsea Kane Staub, ammo iti propesion a kas ni Chelsea Kane , ket Amerikana nga aktres ken kumakanta. <END>"
George W. Bush,<START> Ni George Walker Bush ket maysa a politiko nga a nagserbi a kas ti maika-43 a Presidente iti Estados Unidos manipud idi 2001 aginggana idi 2009 ken ti maika-46 a Gobernador iti Texas manipud idi 1995 aginggana idi 2000. <END>
John C. Calhoun,"<START> Ni John Caldwell Calhoun ket maysa idi a mangiyununa a politiko ken politiko a teorista manipud idiay South Carolina idi panawen ti umuna a kagudua ti maika-19 a siglo. Ni Calhoun ket nalaing nga agbitbitla kadagiti amin a banbanag iti panawenna, ngem isu ket kanayon a nangiyallatiw ti puestona. Ni Calhoun ket nangirugi ti politiko a karerna a kas maysa a nasionalista, agpabpabaro, ken nangipakpatakder ti napigsa a nailian a gobierno ken dagiti panagsalaknib a taripa. Kalpasan idi 1830 isu ket nangyallatiw iti karbengan ti estado, patingnga a gobierno, nulipikasion ken nawaya a komersio. Isu ket nalatak nga ammo iti nakaro a panagdepensana iti panagtagabu a kas maysa a nasayaat a banag, ti saan a pannakatalgedna iti mayoritarismo, ken ti panagiturong ti Abagatan a makisina iti Kappon. <END>"
René Préval,<START> Ni René García Préval ket maysa a politiko manipud iti Haiti. <END>
Hubert Humphrey,"<START> Ni Hubert Horatio Humphrey, Jr., ket nagserbi babaen ni Presidente Lyndon B. Johnson a kas ti maika-38 a Bise Presidente iti Estados UNidos. <END>"
Ellen Burstyn,"<START> Ni Ellen Burstyn ket maysa nga Amerikana nga aktres. Ti pagsapulanna ket nangrugi iti teatro idi las-ud dagiti naladaw a tawen ti 1950, ken dagiti nadumaduma a pelikula ken dagiti serye ti telebision kadagiti simmaruno a dekada. <END>"
Whang-od,"<START> Ni Whang-od Oggay (Pannakaibalikas iti umuna a nagan: [ˈɸɑŋ:ˈəd]; naiyanak idi Pebrero 17, 1917, ammo pay a kas ni Maria Oggay, ket ti Filipina mammatek manipud idiay Buscalan, Tinglayan, Kalinga, Filipinas. Isu ket masansan a maibagbaga a kas ti 'maudi' ken kabaketan a manbatek ken parte ti tattao a Butbut iti dakdakkel a grupo ti etniko ti Kalinga. <END>"
Amanda Bynes,<START> Ni Amanda Laura Bynes ket dati nga Amerikana nga aktres. <END>
Joseph Estrada,"<START> Ni Joseph 'Erap' Ejercito Estrada ket isu idi ti Maika-13 a Presidente ti Filipinas, a nagserbi manipud idi 1998 aginggana idi 2001. Ni Estrada ket isua ti immuna a tao iti kalpasan ti panawen ti EDSA a nabutosan a kas presidente ken Bise presidente. <END>"
Marlee Matlin,"<START> Ni Marlee Beth Matlin ket maysa nga Amerikana nga aktres. Isu ket nangabak iti Kalaingan nga Aktres para iti Children of a Lesser God (1986), ken isu laeng ti maymaysa a tuleng a nangabak iti dayta a gunguna. Ti obrana iti pelikula ken telebision ket nagresultaan iti gunguna iti Nabalitokan a Globo, ken adda pay dagiti dua a maipatinayon a nominasion, ken dagiti uppat a nominasion ti Emmy. Isu ket tuleng manipud idi agtawen iti 18 a bulan, isu ket prominente pay a miembro ti National Association of the Deaf. Ti napauten a nangipatpatarus kaniana ket ni Jack Jason. <END>"
Helen Hayes,"<START> Ni Helen Hayes MacArthur ket maysa idi nga Amerikana nga aktres a ti pagsapulanna ket gangani a nagpaut kadagiti 80 a tawen. Isu ket kanungpalan a nakaala iti birngas a kas ti 'Umuna a Balasang ti Teatro ti Amerikano' ken maysa idi kadagiti 12 a tattao a nangabak iti Emmy, Grammy, maysa nga Oscar ken Gunguna ti Tony. Nakaawat pay ni Hayes ti Presidensial a Medalia ti Wayawaya, ti kangatuan a pammadayaw iti paisano, manipud kenni Presidente Ronald Reagan idi 1986. <END>"
Charlene Gonzales,"<START> Ni Charlene Gonzáles Muhlach ket maysa a personalidad ti telebision ken pelikula ken sigud a reina ti kapintasan manipud idiay Filipinas. <END>"
John Goodman,<START> Ni Jonathan Stephen 'John' Goodman. ket Amerikano nga aktor. <END>
Fidel V. Ramos,<START> Ni Fidel Valdez Ramos ket ti maika-12 a Presidente ti Filipinas. Sinarunona ni Corazon Aquino ket nagtakem agingga iti 1998 a panangsublat ni Joseph Estrada. <END>
Lapulapu,"<START> Ni Lapulapu, maysa a Muslim a pangulo iti Isla ti Mactan iti Cebu iti Filipinas. Mabigbig kas kaunaan a nativo ti arkipelago ti Filipinas a nangbusor iti kolonisasion dagiti Espaniol, maibilang ni Lapulapu a kas umuna a nailian a bannuar iti Filipinas. <END>"
Maurice Béjart,"<START> Ni Maurice Béjart ket maysa idi a naiyanak idiay Pransia a sumasala, koreograpo ken direktor ti opera a nangpatpatarray iti Béjart Ballet Lausanne idiay Suisa. Isu ket nagungunaan idi pimmusay iti pannakaumili iti Suisa. <END>"
Georges Pompidou,"<START> Ni Georges Jean Raymond Pompidou ket isu ti Primo Ministro ti Pransia manipud idi 1962 aginggana idi 1968, isu ti nagtengngel ti kapautan a panagtaken iti daytoy a puesto, ken kalpasanna nagbalin a Presidente ti Republika ti Pransia manipud idi 1969 aginggana idi pimmusay. <END>"
Antonio Villaraigosa,"<START> Ni Antonio Ramón Villaraigosa ket maysa nga Amerikano a politiko a nagserbi a kas ti maika-41 a Mayor ti Los Angles, California manipud idi 2005 aginggana idi 2013. Sakbay a nabutosan a kas Mayor isu ket kameng idi ti Asemblea ti Estado ti California manipud idi 1994 aginggana idi 2000, ti Demokratiko a daulo ti Asemblea manipud idi 1996 aginggana idi 1998, ken ti Tagabitla ti Asemblea ti Estado ti California manipud idi 1998 aginggana idi 2000. Kalpasan iti ipapanaw iti Asemblea ti Estado gapu kadagiti patingga iti termino. Isu ket nabutosan iti Konsilio ti Siudad ti Los Angles manipud idi 2003 aginggana idi nabutosan a kas Mayor idi 2005. <END>"
Adam Levine,"<START> Ni Adam Noah Levine ket Amerikano a kumakanta, mannurat ti kanta, multi-instrumentalista ken aktor. Isu ti daulo a bokalista para iti Maroon 5, ti pop rock a banda manipud iti Los Angeles. <END>"
Vilma Santos,"<START> Ni Vilma Santos-Recto, kaaduan nga ammo a kas ni Ate Vi, ket Filipina nga aktres ken politiko. Isu ket ammo a kas ti Bida iti Amin a Pnawen para kadagiti nadumaduma a papelna kadagiti nadumaduma a kita dagiti sinena ken agtengngel iti titulo ti Grand Slam Queen ken kas ti kapautan a nagturay a reina ti takilia iti sinema ti Filipinas. Ni Santos ket maysa pay a politiko, ken agdama nga agserbi akas ti Gobernador ti Batangas ken dati a mayor ti Siudad ti Lipa. <END>"
Elbridge Gerry,"<START> Ni Elbridge Thomas Gerry ket maysa idi nga Amerikano a estadista ken diplomatiko. A kas Demokratiko-Republikano isu ket napili a kas ti maikalima a Bise Presidente iti Estados Unidos (1813–1814), a nagserbi babaen ni James Madison, aginggana idi pimmusay kalpasan ti maysa ket kagudua a tawen iti terminona. <END>"
Muddy Waters,"<START> Ni McKinley Morganfield, ammo pay iti naganna iti enteblado iti Muddy Waters, ket maysa idi nga Amerikano a musikero iti blues a masansan a nadakdakamat a kas ti ama ti moderno a Chicago blues'. <END>"
"Benigno S. Aquino, Jr.","<START> Ni Benigno Simeon 'Ninoy' Aquino, Jr. ket maysa a kangrunaan nga oposisionista a politiko iti Filipinas kabayatan ti administrasion ni Presidente Ferdinand E. Marcos. Napaltogan isuna iti Internasional nga Eropuerto ti Manila idi agawid manipud iti panagnaedna kas pammagtalaw iti Estados Unidos. Daytoy nga asasinasion, a naipabasol iti rehimen a Marcos, ti nangrugian ti pannakatippuog ti diktadoria ni Marcos, a nagingga iti Rebulosion iti EDSA idi Pebrero 1986 a nakaigapuan met ti pannakaipatugaw kas presidente ni Corazon Aquino, balo ni Aquino. <END>"
Patrick Modiano,"<START> Ni Jean Patrick Modiano ket Pranses a nobelista ken ti nagungunaan ti Premio Nobel iti Literatura ti 2014. Isu ket dati a nangabak iti Premio Estado ti Austria para iti Europeano a Literatura idi 2012, ti Prix mondial Cino Del Ducaidi 2010 manipud ti Institut de France, ti Prix Goncourt idi 1978 para iti Rue des boutiques obscures, ken tie Grand Prix du roman de l'Académie française idi 1972 para iti Les Boulevards de ceinture. Dagiti obrana ket naipatarusen kadagiti ad-adu ngem 30 a pagsasao ken naramrambakan idiay ken iti lawlaw iti Pransia, ngem bassit laeng ti naipablaak iti Ingles idi nagungunaan isuna iti Premio Nobel. <END>"
Manuel Roxas,<START> Ni Manuel Acuña Roxas ket isu idi ti immmuna a presidente iti nawaya a Maikatlo a Republika ti Filipinas ken ti maikalima a presidente iti amin a presidente iti Filipinas. Nagserbi isuna a kas presidente manipud iti pannakaited ti pannakawaywaya idi 1946 aginggana itiipupusay na idi 948. Ti panagturayna a kas presidente ti Filipinas ket isu ti kabiitan a nagpaut ti 1 a tawen 10 bulan ken 18 nga aldaw. <END>
Daniel D. Tompkins,"<START> Ni Daniel D. Tompkins ket isu idi ti maikapat a Gobernador iti New York (1807–1817), ken ti makanem a Bise Presidente iti Estados Unidos (1817–1825). <END>"
P. T. Barnum,"<START> Ni Phineas Taylor Barnum ammo pay a kas ni P. T. Barnum ket maysa idi nga Amerikano a negosiante, politiko ken ti nangbangon ti Barnum & Bailey Circus. <END>"
Antoine Laurent de Jussieu,"<START> Ni Antoine Laurent de Jussieu maysa idi a Pranses a botaniko, a naindayegan a kas ti immuna a nangipalaak iti natural a pannakaidasig dagiti agsabsabong a mula; kaaduan iti sistemana ket agtultuloy a maus-usar tatta nga aldaw. Ti panangidasigna ket naibatay iti ken naipaatiddog a di-naipablaak nga obra babaen ti ulitegna, ti botaniko a ni Bernard de Jussieu. <END>"
Paul Scofield,"<START> Ni David Paul Scofield, kaaduan nga ammo a kas ni Paul Scofield, ket maysa idi nga Ingles nga aktor ti entablado ken pelikula. <END>"
Henrik Pontoppidan,<START> Ni Henrik Pontoppidan ket maysa idi a realista a mannurat a nakibinningay kenni Karl Gjellerup ti Premio Nobel iti Literatura idi 1917 para iti 'autentiko a deskripsionna iti agdama a kabibiag idiay Dinamarka.' <END>
Tom Hanks,"<START> Ni Thomas Jeffrey Hanks ket Amerikano nga aktor ken agpatpataud iti pelikula. Isu ket ammo kadagiti papelna iti Splash (1984), Big (1988), Philadelphia (1993), Forrest Gump (1994), Apollo 13 (1995), Saving Private Ryan, You've Got Mail, The Green Mile (1999), Cast Away (2000), The Da Vinci Code (2006), Captain Phillips, ken Saving Mr. Banks, ken ti pay obra iti boses kadagiti animado a serye iti The Polar Express (2004) ken ti Toy Story. <END>"
Carl Spitteler,<START> Ni Carl Friedrich Georg Spitteler ket maysa idi a Suiso a mannaniw a nagunggunaan ti Premio Nobel iti Literatura idi 1919. Dagiti obrana ket mairaman dagiti pesimista ken natured a dandaniw. <END>
Donald Trump,"<START> Ni Donald John Trump ket maysa nga Amerikano a negosiante, personalidad ti telebision, politiko, ken ti Maika-45 a Presidente ti Estados Unidos. <END>"
Geraldine Page,"<START> Ni Geraldine Sue Page ket maysa idi nga Amerikana nga aktres ti pelikula, telebision ken entablado. Isu ket namin-walo a nominado iti Gunguna ti Akademia, nainominado isuna idi para iti Hondo (1953), Summer and Smoke (1961), Sweet Bird of Youth (1962), You're a Big Boy Now (1966), Pete 'n' Tillie (1972), Interiors (1978) ken ti The Pope of Greenwich Village (1984), sakbay a nangabak iti Kalaingan nga Aktres para iti pannagiladawanna a kas ni Carrie Watts iti The Trip to Bountiful (1985). <END>"
Heart Evangelista,"<START> Ni Heart Evangelista ket Filipina nga aktres, mangsansangaili iti pabuya ti telebision, kumakanta, ken VJ. <END>"
Gloria Swanson,"<START> Ni Gloria May Josephine Swanson ket maysa idi nga Amerikana nga aktres, kumakanta ken produser a kaaduan nga ammo para iti papelna a kas ni Norma Desmond, ti reklusibo a bida ti naulimek a pelikula, iti kritikal a naipammadayawan a pelikula idi 1950 iti Sunset Boulevard. <END>"
George Washington,"<START> Ni George Washington ket isu ti immuna a Presidente iti Estados Unidos iti Amerika, a nagserbi manipud idi 1789 aginggana idi 1797, ken isu ti nangruna a militar ken politikal a daulo iti Estados Unidos manipud idi 1775 aginggana idi 1799. Indauloanna ti Amerikano a panagballigi iti Gran Britania iti Rebolusionario a Gubat ti Amerikano a kas ti Agbilbilin a mangipangulo iti Kontinental a Buyot manipud idi 1775 aginggana idi 1783, ken nagipangulo iti panakaisurat iti Batay-linteg idi 1787. Ni Washington ket nagbalin ti umuna apresidente, babaen ti nagtutunos a panagpili, kenisu ti nagidaulo ti panakapartuat iti maysa a napigsa, nasayaat a nabusbusan a nailian a gobierno a nagtaripato ti neutralidad kadagiti gubat a rimsua idiay Europa, nagpatalna kadagiti rebelion, ken nakaala kadagiti panagawat kadagiti nadumaduma a kita ti Amerikano. Ti estilo ti panagidaulona ket nangipatakder kadagiti adu a porma ken ritos iti gobierno a naus-usaren manipud idin, a kas ti panagusar ti maysa a gabinete a sistema ken ti panagital-o ti panagrugi a bitla. Ni Washington ket sangalubongan a naipammategan a kas ti 'Ama ti Pagilianna.' <END>"
Marian Anderson,"<START> Ni Marian Anderson ket maysa idi nga Amerikana a contralto ken maysa kadagiti kaselebraduan a kumakanta iti maika duapulo a siglo. Kinuna ni Alan Blyth ti kritiko iti musika: 'Napintas idi ti bosesna, natinggaw a contralto iti intrinsiko a kapintas.' Kaaduan iti pagsapulanna iti panagkanta ket iti panagpabpabuya iti konserto ken iti panagresita kadagiti nangruna a pasamak iti musika nga agraman kadagiti nadayeg nga orkestra iti amin a paset ti Estados Unidos ken Europa idi baetan ti 1925 ken 1965. Urayno naidatona kadagiti papel kadagiti adu nga importante a kompania ti orkestra idiay Europa, saan met a nagkayat ni Anderson, gapu ta saan met a nagsanay iti panangipapel. Kinaykayatna idi iti panagpabuya iti konserto ken panagresita laeng. <END>"
Anna May Wong,"<START> Ni Anna May Wong ket isu idi ti immuna nga Insik Amerikano a nagbida iti pelikula, ken ti immuna a Asiano Amerikano nga aktres a nakagun-od iti sangalubongan a pannakabigbig. Ti atiddog ken nagdumaduma a karerna ket mairaman iti naulimek ken adda uni a pelikula, telebision, teatro ken radio. <END>"
Asta Nielsen,"<START> Ni Asta Nielsen ket maysa idi a Danes nga aktres iti naulimek a pelikula ken maysa maysa kadagiti kadayegan a nagbida a babbalasang kadagiti tawen ti 1990 ken maysa kadagiti immuna a sangalubongan a bida ti pelikula. Pitopulo kadagiti 74 a pelikula ni Nielsen ket naaramid idiay Alemania nga idiay ket simple laeng nga ammo a kas Die Asta. Ammo para iti dakkel ken nangisit a mata, kasla maskara a rupa ken lakien a pigura, ni Nielsen ket kaaduan a nangiladawan iti napigsa iti nakem a naregget a babbai a nakulong babaen dagiti trahiko a sirkumstansia. Gapu ti erotika a kasasaad dagiti pabuyana, dagiti pelikula ni Nielsen ket nakaruda a nasensura idiay Estados Unidos ken dagiti obrana ket ralatibo a saan unay nga ammo kadagiti agpuybuya a taga-Amerika. <END>"
Roberto Benigni,"<START> Ni Roberto Remigio Benigni, Cavaliere di Gran Croce OMRI ket Italiano nga aktor, komidiante, mannurat ti senario ken direktor. Isu ket kimmuyog a nagsurat, nangiturong ken nagarte iti pelikula ti 1997 iti Life Is Beautiful, ken isu daytoy iti nangabakanna iti Kalaingan nga Aktor ken Gunguna ti Akademia para iti Kalaingan a Pelikula ti Ganaganaet a Pagsasao. <END>"
Sarah Geronimo,"<START> Ni Sarah Geronimo ket Filipina a kumakanta, aktres ken personalidad iti telebision. <END>"
Taylor Lautner,"<START> Ni Taylor Daniel Lautner ket Amerikano nga aktor, ken modelo. <END>"
Jeremy Renner,"<START> Ni Jeremy Lee Renner ket Amerikano nga aktor, kumakanta, ken produser ti pelikula. <END>"
Tsai Ing-wen,"<START> Ni Tsai Ing-wen ket ti presidente ti Republika ti Tsina (Taiwan) ken ti immuna a babai a nabutosan iti opisina. Isu pay ti immuna a presidente a Hakka ken Aborihinal a kaputotan, isunto ti umuna a balasang a presidente ken ti umuna a mangtengngel iti puesto iti nabutosan a puesto. Isunto ti agbalin a maikadua a babai a daulo iti estado iti Daya nga Asia kalpasan ti agdama a Presidente ti Abagatan a Korea a ni Park Geun-hye. Isu ti agdama a mangipangulo a babai iti Partido Demokratiko Progresibo (DPP),ken ti kandidato iti presidente ti partido iti panagbubutos ti presidente ti Taiwan idi 2012 ken 2016. Ni Tsai ket dati a nagserbi a kas mangipangulo iti partido manipud idi aginggana idi 2012. <END>"
