Title,First Paragraph
Bette Davis,"<START> Ni Ruth Elizabeth 'Bette' Davis ket maysa idi nga Amerikana nga aktres iti pelikula, telebision ken teatro. Naikeddeng a kas maysa kadagiti kalatakan nga aktres iti pakasaritaan ti Hollywood, isu ket ammo para iti panagtalekna nga agpapel iti di simpatetiko, sardoniko a karkarakter ken kaaduan nga ammo para kadagiti panagpabpabuyana iti sakop dagiti kita ti pelikula, manipud iti kontemporaneo a melodarama ti krima aginggana iti historikal ken paset ti panawen dagiti pelikula ken dagiti sagpaminsan a komedia, ngem ti kalatakan a balligina ket ti papel dagidi romantiko a drama. <END>"
Clark Gable,"<START> Ni Clark Gable ket maysa idi nga Amerikano nga aktor iti pelikula, masansan a naibagbaga a kas 'Ti Ari ti Hollywood' wenno simple laeng a kas 'Ti Ari'. Inrugi ni Gable ti karerna a kas aktor ti entablado ken nagparang a aks ekstra kadagiti naulimek a pelikula kadagiti baetan ti 1924 ken 1926, ken nagprogreso kadagiti mangsuporta a papel kadagiti pelikula para iti MGM iti 1931. Ti simmaruno a tawen, nakaal iti immuna a bida a papelna iti Hollywood ken nagbalin a bida a lalaki kadagiti ad-adu ngem 60 a pelikula kadagiti simmaruno a tallo a dekada. <END>"
Spencer Tracy,"<START> Ni Spencer Bonaventure Tracy ket maysa idi nga Amerikano nga aktor, ammo idi para iti natural nga estilona ken bersatilidad. Maysa kadagiti kangrunaan nga artista ti Nabalitokan a Panawen ti Hollywood, nainominado ni Tracy para kadagiti siam a Gunguna ti Akademia para iti Kalaingan nga Aktor ken nangabak iti dua, ken makibinningay iti rekord para kadagiti nominasion iti dayta a kategoria kenni Laurence Olivier. <END>"
Herbert Giles,"<START> Ni Herbert Allen Giles ket maysa idi a Briton a diplomata ken sinologo nga isu idi ti propesor ti Insik idiay Unibersidad ti Cambridge para kadagiti 35 a tawen. Ni Giles ket nasursuruan idi idiay Charterhouse School sakbay a nagbalin a Briton a diplomata idiay Tsina. Binaliwanna ti sistema ti romanisasion ti Insik a Mandarin a pinundar babaen ni Thomas Wade, a nagresultaan daytoy iti adu a kaammo iti sistema ti romanisasion ti Insik iti Wade–Giles. <END>"
John Forbes Royle,"<START> Ni John Forbes Royle, ket Britaniko a botaniko ken manursuro ti materia medica, naipasngay idi idiay Kanpur idi 1799. Isu ket simrek iti serbisio ti Kompania ti Daya nga India a kas katakunaynay a sirhano, inruknoyna ti bagina iti panagadal ti botanika ken heolohia, ken nagaramid kadagiti adu nga urnong dagiti Banbantay ti Himalaya. Isu ket nagsukimat pay kadagiti medisina a tagikua dagiti mula ti Indostan ken ti pakasaritaan dagiti usarda kadagiti patneng a pulis. Dagiti resulta dagitoy a panagsuksukimat ket naiparang iti maysa a salaysay Iti Kinaugma ti Hindu a Medisina (1837). Kadagiti napalabas a sangapulo a tawen isu ket nagtengngel ti puesto iti superintendente ti botaniko a hardin ti Kompania ti Daya nga India iti Himalaya idiay Saharanpur. Idi 1837 isu ket naidutok iti kinapropesor iti materia medica idiay Londres a Kolehio ti Ari, nga isu ket nagtengngel ti puesto aginggana idi 1856. Manipud idi 1838 ken iti masakbayan isu ket nagaramid ti espesial a departamento iti pannakisurat a maipanggep kadagiti produkto ti nateng, idiay Kamara ti Daya nga India, ken idi panawen ti ipupusayna kalkalpasna idi idiay ti ekstensino ken nangruna a museo dagiti teknikal a produkto manipud kadagiti Daya nga India. Idi 1851 isu ti nangimaton ti departamento ti India iti Nalatak nga Eksibision. Isu ket pimmusay idiay Acton idiay asideg ti Londres idi 2 Enero 1858. <END>"
Paul Sidwell,"<START> Ni Paul James Sidwell ket maysa nga Australiano lingguista a naikuartel idiay Canberra, Australia a nagtengngel kadagiti puesto iti panagsukisok ken lektura iti Nailian nga Unibersidad ti Australia. Ni Sidwell, nga isu ket eksperto pay ken ken agbalbalakad iti porensiko a lingguistika, ket nadayeg iti obrana iti naipakasaritaan a lingguistika iti pamilia ti pagsasao ti Austroasiatiko, ken nakaipablaak kadagiti rekonstruksion dagiti proto-pagsasao ti Bahnariko, Katuiko, ken Palaungiko. Ni Sidwell ket agdama a Presidente ti Kagimongan ti Lingguistika ti Abagatan a daya nga Asia. <END>"
Arturo Tolentino,<START> Ni Arturo Modesto Tolentino ket maysa id a prominente a pigura iti politika idiay Filipinas ken nabiit idi a nagtengngel iti puesto ti bise presidente. Isu ket nalatlatak nga ammo a kas ti ama ti “doktrina ti purpuro” iti Filipinas ken eksperto iti Linteg iti Baybay. <END>
Pedro Almazán,"<START> Ni Don Pedro Almazán, ti nabaknang a daulo manipud idiay Ilocos Norte, ket isu idi ti nangidaulo ti immuna a yaalsa ni Ilokano. Gapu kadagiti ganetnetna, ni Ilokano ket isuda idi ti immuna a grupo ti etniko iti ruar ti Manila a nagrebelde iti turay ti Espaniol. <END>"
Jesse Robredo,<START> Ni Jesse Manalastas Robredo ket maysa nga Sekretario iti Kaunegan ken Lokal a Gobierno. <END>
Alfredo Lim,"<START> Ni Alfredo Siojo Lim ket dati a Filipino a politiko ken polis a nagserbi a kas maysa a senador manipud idi 2004 aginggana idi 2007. Nagserbi pay isuna a kas mayor ti Manila idi 1992 aginggana idi 1998, ken manen idi 2007 aginggana idi 2013. <END>"
Nicolaas Laurens Burman,<START> Ni Nicolaas Laurens Burman (1734–1793) ket maysa idi nga Olandes a botaniko. <END>
Naguib Mahfouz,"<START> Ni Naguib Mahfouz ket maysa idi nga Ehiptiano a mannurat a nangabak ti 1988 a Premio Nobel iti Literatura. Nipammategan isuna a kas dagiti immuna a kontemporario a mannurat iti Arabiko a literatura, a naisakup ti Tawfiq el-Hakim, nga agsukisok ti tema iti eksistensialismo. Nagipablaak isuna kadagiti sumurok a 50 a nobela, sumurok a 350 ababa a sarita, sangadosena kadagiti naisuratan a mabybuya, ken lima a pabuya iti sumurok a 70 a tawen a karer. Adu kadagiti obrana ket naaramid kadagiti Ehiptiano ken ganganaet a pelikula. <END>"
Yevgeny Leonov,"<START> Ni Yevgeny Pavlovich Leonov ket maysa idi a nadayeg a Ruso/Sobiet nga aktor a nagiladawan kadagiti nangruna a parte dagiti nadumaduma a nadayeg a pelikula ti Sobiet. Tinawtawagan isuna kas ti 'maysa kadagiti inay-ayat nga aktor iti Rusia', ken nagited pay iti boses para kadagiti adu a karakter ti kartoon a mairaman ti Vinny Pukh (Winnie-the-Pooh). <END>"
Marie Curie,"<START> Ni Marie Salomea Skłodowska-Curie ket maysa idi a Pranses-Polako a pisiko ken kimiko, a naindayegan para iti pionero a panagsukimat iti radioaktibidad. Isu ti immuna a babai a nangabak ti Premio Nobel, is-isu ti babai a nangabak ti dua a pag-obraan, ken is-isu ti nangabak iti ad-adu ngem maysa a siensia. Isu pay idi ti immuna a babai a propesor idiay Unibersidad ti Paris, ken idi 1995 isu ti nagbalin nga immuna a babai a naipunpon kadagiti bukodna a pammadayaw iti Panthéon idiay Paris. <END>"
Qin Shi Huang,"<START> Ni Qin Shi Huang (Wade-Giles: Chin Shih Huang; Insik: 秦始皇; 259 BC – 210 BC; personal name: Zhao Zheng ; nagan iti klasiko nga Insik: ket isu idi ti ari ti Insik nga Estado ti Qin manipud idi 246 BC aginggana idi 221 BC, idi las-ud ti Paset ti panawen dagiti Naggugubat nga Estado. Isu ti nagbalin nga immuna nag emperador ti nagkaykaysa a Tsina idi 221 BC. Isu ket nagturay aginggan idi pimmusay idi 210 BC iti tawen a 49. <END>"
Simone de Beauvoir,"<START> Ni Simone-Ernestine-Lucie-Marie Bertrand de Beauvoir, kadawyan a naamammoan a kas ni Simone de Beauvoir, ket maysa idi a Pranses a mannurat, intelektual, eksistentialista a pilosopo, politikal anga aktibista, pemenista, ken sosial a teorista. Bayat nga isu ket sanna nga inpanpanunotan nga isu ket maysa a pilosopo, ni de Beauvoir ket adda ti adu nga inpluensia iti pemenista nga eksistentialismo ken peminista a teoria. ni de Beauvoir ket nagsursurat kadagiti nobela, salaysay, dagiti biograpia, ti maysa nga autobiograpia, dagiti monograpia iti pilosopia, politika, ken dagiti sosial a banbanag. Isu ket nalatak a naamammoan kadagiti nobelana, a mairaman ti Ti Babbai ket Immay a Nagbati kenDagiti Mandarin, ken ti pay 1949 a treatado Ti Maikadua a Sekso, ti maysa a naisalaysayan a panagusig ti panagirurumen kadagiti babbai ken ti panagibatayan a turong ti kontemporario a peminismo. <END>"
Ovidio,"<START> Ni Publius Ovidius Naso, naamammoan pay a kas ni Ovid iti agsasao ti Ingles a lubong, ket maysa idi a a Romano a mannaniw a kasayaatan a naamammoan a kas ti nagsurat ti tallo a kangrunaan nga urnong ti daniw, ti Heroidas, Amores ken Ars Amatoria, ken ti Metamorposis, ti maysa a mitolohiko a heksametro a daniw. Isu ket nadayeg a naamammoan para iti Fasti, a maipanggep ti Romano a kalendario, ken ti Tristia ken ti Epistulae ex Ponto, ti dua nga urnong dagiti daniw a naisurat idi idu ket naipatalaw idiay Baybay aNangisit. Ni Ovidio ket isu pay ti nagsurat kadagiti nadumaduma a babbassit a pirgis, tiRemedia Amoris, ti Medicamina Faciei Femineae, ken ti atiddog a lunod a daniw nga Ibis. Isu ket nagsurat pay ti napukaw a trahedia, a Medea. Isu ket naipanpanunotan a kas ti apo ti naliday a kopla, ket tinawtawidan anairanggo a kumaduann ni Virgilio ken ni Horacio a kas maysa kadagiti tallo a kanoniko a mannaniw ti Latin a literatura. Ti eskolar a ni Quintiliano ket nangipanunot kaniana a kas ti kinaudi kadagiti kononikal nga elehista ti ayat iti Latin. Ti daniwna, nga adu a tinultulad idi las-ud ti Naladaw a Kina-ugma ken ti Tengnga a Panpanawen, nga kaaaduan a nakaimpluensia ti Europeaano nga arte ken literaturae ken agtultuloy a kas maysa kadagiti kangrunaan a nagtataudan ti klasiko a mitolohia. <END>"
Marcel Proust,"<START> Ni Valentin Louis Georges Eugène Marcel Proust ket maysa idi a Pranses a nobelista, kritiko, ken manalaysay a kasayaatan nga ammo para iti bukodna a monumental a À la recherche du temps perdu. Daytoy ket naipablaak kadagiti pito a paset idi baetan ti 1913 ken 1927. Isu ket naikeddeng a maysa kadagiti kalatakan a mannurat iti amin a panawen. <END>"
Genghis Khan,"<START> Ni Genghis Khan, ket naipasngay idi a kas ni Temujin, ket isiu idi ti nangibangon ti Nalatak a Khan (emperador) iti Mongol nga Imperio, a daytoy ket isu ti nagbalin a kadakkelan a nagtultuloy nga imperio iti pakasaritaan kalpasan ti ipupusayna. <END>"
Alexander Pushkin,<START> Ni Alexander Sergeyevich Pushkin ket maysa idi a Ruso a mannurat ti Romantiko a panawen nga isu ti naipanpanunotan babaen dagiti adu a ti kalatakan a Ruso a mannaniw ken ti nangbangon ti moderno a Ruso a literatura. <END>
Paul Reubens,"<START> Ni Paul Rubenfeld, ket Amerikano nga aktor. <END>"
Isabel I iti Inglatera,"<START> Ni Isabel I ket isu idi ti reina a nagari iti Inglatera ken Ireland manipud idi 17 Nobiembre 1558 aginggana idi pimmusay. Sagpaminsan a tinawtawagan a kas Ti Birhen Reina, Gloriana, wenno Naimbag a Reina Bess, ni Isabel ket isu idi ti maikalima ket ti naudi a monarkia ti Tudor a dinastia. Isu ket anak a babai ni Enrique VIII, isu ket naipasngay id a kas maysa a prinsesa, ngem ti inana, a ni Anne Boleyn, ket naipapatay idi tidua ket kagudua a tawtawen kalpasan ti panakaipasngayna, ken ni Isabel ket nairangarang a kas maysa nga anak ti ruar. Ti kagudua a kabsatna a lalaki, Eduardo VI, nangpatawid ti balangat kenni Balasang Jane Grey, a nangikkat daytoy kadagiti kagudua a kakabsatna, a ni Isabel ken ti Katoliko a ni Maria, ti panakaisaruno urayno daytoy ket saan a ti kalintegan.Ti testamentona ket naisiasi, ni Maria ket nagbalin a reina, ken ni Balasang Jane Grey ket naipapatay idi. Idi 1558, ni Isabel ket sinarununa ti kagudua a kabsatna a babai, nga isu idi ket naibalud ti nasurok a makatawen idi nagturturay gapu ti panakailemanna ti panagsuporta kadagiti rebelde a Protestante. <END>"
Francisco Manuel Blanco,<START> Ni Francisco Manuel Blanco (1778–1845) ket maysa idi a Kastila a prayle ken botaniko. <END>
Juana ti Arko,"<START> Ni Juana ti Arko, a parbo ti nagan a kas 'Ti Katulong iti Orléans', ket maysa a bannuar ti Pransia ken maysa a Romano Katoliko a santo. Isu ket naipasngay a kas maysa a mannalon a babai iti tatta nga aldawen ti akindaya a Pransia. A timmunton ti nainlangitan a pannakaiturong, isu ket nangidaulo ti buyot ti Pransia kadagiti nangruna a panagballigi idi las-ud ti Gubat ti Sangagasut a Tawtawen, a nagited ti pakadalanan ti pannakabalangat ni Karlos VII iti Pransia. Isu ket natiliw babaen dagiti Borgona, ket naisubli ket naipasukat iti kuarta kadagiti Inggles, naidarum babaen dagiti nagkaykayat ti Inggles nga Obispo iti Beauvais a ni Pierre Cauchon para kadagiti panagpabasol a 'insubordinasion ken heterodoksia', ken idi ket pinuoran iti pasok para iti herehia idi idu ket agtawen ti 19. <END>"
Rosa Luxemburg,"<START> Ni Rosa Luxemburg ket maysa idi a Marxista teorista, philosopo, ekonomista ken rebolusionario a sosialisa ti kaputotan a Polako Hudio a nagbalin a naturalisado nga umili ti Alemania. Isu ket kameng idi ti Sosial a Demokrasia ti Pagarian ti Polonia ken Lituania (SDKPiL), ti Partido Sosial Demakratiko ti Alemania (SPD), ti Partido ti Nawaya a Sosial Demoktatiko (USPD), ken ti Partido Komunista ti Alemania (KPD). <END>"
Toni Morrison,"<START> Ni Toni Morrison ket maysa nga Amerikana a nobelista, editor, ken propesor. Dagiti nobelana ket ammo kadagiti epiko a tema, narugso a dialogo, ken nabaknang kadagiti naisalaysayan a karakter. Dagiti kalatakan a nobelana ket mairaman ti Ti Kaasulan a Mata, Sula, Kanta ni Solomon ken Nadunggo. Nakomisionado pay isuna a nagsurat iti librito para iti maysa a baro nga opera, ti Margaret Garner, nga immuna a naipabuya idi 2005. Isu ket nangabak iti Premio Nobel idi 1993 ken idi 1987 ti Premio Pulitzer para iti Nadunggo. Idi 29 Mayo 2012, isu ket nagunggunaan ti Presidensial a Medalia ti Waya. <END>"
Sopokles,"<START> Ni Sopokles ket maysa kadagiti tallo a taga-ugma a Griego a trahiko a nagbiag dagiti pabuyana. Dagiti immuna a pabuyana ket naududi a naisursurat ngem kenni Eskuilo, ken nasapsapa ngem wenno kontemporario kenni Euripides. Segun ti Suda, ti maika-10 a siglo nga ensiklopedia, ni Sopokles ket nagsurat kadagiti 123 a pabuya iti las-ud ti panagbiagna, ngem adda laeng ti pito a nabatbati iti kompleto a porma: ti Ajax, Antigona, Ti Babbai ti Trachis, Edipo ti Ari, Elektra, Piloktetes ken Edipo idiay Kolono. Iti gangani a 50 a tawtawen, niu Sopokles ket isu idi ti kalaingan a dramaturgo kadagiti dramatiko a panakibinglayan ti siudad-estado ti Atenas a napasamak idi las-ud dagiti relihioso a rambakan ti Lenaea ken ti Dionysia. Isu ket nakibinninglay kadagiti 30 a pagbibinglayan, ken mabalin a nagabak ti 24, ken saan a naipato ti nababbaba ngem maikadua a lugar. Ni Eskuilo ket nangabak ti 14 a pagbibinglayan, ket sagpaminsan nga inababakna ni Sopokles, bayat a ni Euripides ket nangabak laeng ti 4 a pagbibinglayan. <END>"
Rabindranath Tagore,"<START> Ni Rabindranath Thakur, naiyulog iti Ingles iti Tagore pannakabalikas (tulong·pakaammo), parbo a nagan Gurudev, ket maysa idi a Bengali nga eroditu a nangsukog ti literatura ken musika iti rehionna. Isu ket ti nangsurat ti Gitanjali ken ti 'makaarsagid unay, nasadiwa ken napintas a berso', isu ti immuna a saan nga Europeano a nangabak ti Premio Nobel iti Literatura idi 1913. Iti pannakaipatarus ti daniwna idi ket napanirigan a kas espiritual ken merkurial; ti kasla makapaturog a personalidadna, umay-ayud a buok, ken naisalsalumina a panagkawwes ket nakagun-od iti kasla propeta a reputasion iti laud. Dagiti 'elegante a prosa ken naenkantuan a prosa' ket agtultuloy a di naam-ammuan iti ruar ti Bengal. Ni Tagore ket nangiyamammo ti baro a prosa ket dagiti porma ti berso ken ti panagusar ti lokal a pagsasao iti Bengali a literatura, isu a nangwaya daytoy manipud kadagiti tradisional a modelo a naibatay iti klasiko a Sanskrito. Isuna idi ket kaaduan a nakaimpluensia iti panangiyununa kadagiti kasayaatan a kultura ti India iti laud ken ti kasta met iti kultura ti India, ken isu ket sapasap a naipanpanunotan a nalaing a kreatibo nga artista iti moderno nga India. <END>"
Leo Tolstoy,"<START> Ni Lev Nikolayevich Tolstoy ket maysa idi a Ruso a mannurat a kaaduan a nagsursurat kadagiti nobelal ken dagiti ababa a sarita. Iti naladaw a kabibiag, isu ket nagsurat pay kadagiti pabuya ken dagiti salaysay. Ti dua a kadayegan nga obrana, ket dagiti nobel ati Gubat ken Kappia ken Anna Karenina, ket nabigbigan a kas ti dua a kalatakan a nobela iti amin a panawen ken ti kapantokan ti realista a piksion. Adu kadagiti nangipanpanunot kenni Tolstoy a maysa kadagiti kalatakan a nobelista ti lubong. Ni Tolstoy ket ammo pay para kadagiti komplikado ken pradokso a personalidadna ken para ti nangato a moralistiko ken asetiko a pamanunotan, nga inamponna kalpasan ti moral a didigra ken naikararuan a pannakariing idi panawen ti 1870, a kalpsanna ket nagbalin pay a nalaglagipan a kas maysa a moral nga agpanpanunot ken sosial nga agrepreporma. <END>"
Mark Twain,"<START> Ni Samuel Langhorne Clemens ,wenno makunkuna pay a Mark Twain ket maysa a mannurat. Ti novela a Dagiti Pinagsubok ni Tom Sawyer ken ti simmaruno Dagiti Pinagsubok ni Huckleberry Finn ket dua kadagiti kangrunaan a sinurat na. <END>"
Alan Turing,"<START> Ni Alan Mathison Turing, OBE, FRS, ket maysa idi a Britaniko a matematiko, lohiko, kriptoanalista, ken sientista ti kompiuter. Isu ket adu a nakaimpluensia iti panagrang-ay ti siensia ti kompiuter, a nangited ti pormalisasion kadagiti konsepto ti 'algoritmo' ken 'panagkarkulo' iti Turing a makina, a daytoy ket mabalin a mapanunotan a modelo ti sapasap a panggep ti kompiuter. Ni Turing ket kaaduan a naipanpanunotan nga isu ti ama ti siensia ti kompiuter ken artipisial a kasirib. <END>"
Ernie Chan,"<START> Ni Ernesto 'Ernie' Chan, naiyanak ken sagpaminsan a maipammadayawan a kas ni Ernie Chua, ket maysa idi a Filipino-Amerikano nga artista iti komiks, a naam-ammuan para iti obrana nga inpablaak babaen ti Marvel Comics ken DC Comics, ken mairaman kadagiti adu a pablaak dagiti serye ti Marvel a mangiladladawan iti Conan the Barbarian. Nagpaut pay ni Chan iti Batman ken Detective Comics. <END>"
Otto Dempwolff,"<START> Ni Otto Dempwolff ket maysa idi nga Aleman a mangngagas, lingguista ken antropologo nga espesialista iti panagadal iti pamilia ti pagsasao nga Austronesio. <END>"
Ram Revilla,"<START> Ni Ram Revilla, naipasngay a kas ni Ramgen Jose Magsaysay Bautista, makunkuna pay a ni Ramgen Revilla, ket maysa idi a Filipino nga aktor a kangrunaan nga ammo a bida kadagiti serye ti telebision a kas ni Jeff Gatdula iti Tonyong Bayawak. <END>"
Johannes Brahms,<START> Ni Johannes Brahms ket maysa idi nga Aleman a kompositor ken pianista. <END>
Antonín Dvořák,"<START> Ni Antonín Leopold Dvořák ket maysa idi a Tseko a komposer. Kalpasan ti nationalista a kas pagarigan ni Bedřich Smetana, ni Dvořák ket kankanayon a nangipamay-an kadagiti kita ti folk a musika ti Morabia ken ti bukod apanakaumilianna a Bohemia. Naipalawag ti bukod nga estilo ni Dvořák a kas ti napno a pannakaipada ti nailian nga idioma ti simponiko a tradision, a nangsangsagupsop ti folk nga impluensia ket agbirbiruk kadagiti maikeddeng a pamay-an a panagusarda. <END>"
Bing Crosby,"<START> Ni Harry Lillis 'Bing' Crosby, Jr. ket maysa idi nga Amerikano a kumakanta ken aktor. Ti marka ti pabrika ni Crosby ket napintas a boses iti baho-baritono a nagaramid kaniana a kaaduan a nalaklako nga nagrekrekord nga artista iti maika-20, ken nakalako kadagiti maysa a bilion a rekord, tape, compact disc ken digital download iti amin a paset ti lubong. <END>"
Elmer Drew Merrill,"<START> Ni Elmer Drew Merrill ket maysa idi nga Amerikano a botaniko, nga espesialista iti mulmula ti rehion ti Asia-Pasipiko. <END>"
George Frideric Handel,"<START> Ni George Frideric Handel ket maysa idi a Aleman a naipasngay a Britaniko a Baroko a komposer, a nadayeg kadagiti bukodna nga opera, dagiti oratorio, himno ken dagiti organo a konsierto. Ni Handel ket naipasngay idi 1685, iti maysa a pamilia a saan a nagay-ayat ti musika. Isu ket nagagun-od ti nangruna apanakasanay ti musika idiay Halle, Hamburg ken Italia sakbay a nagtaeng idiay Londres (1712) ken nagbalin a naturalisado a suheto ti Britaniko idi 1727. Babaen ti daytan a panawen isu ket napigsa idin a naimpluensiaan babaen dagiti nalatak a komposer ti Italiano a Baroko ken ti tengnga nga Aleman a poliponiko a koro a tawidan. <END>"
Gustav Mahler,"<START> Ni Gustav Mahler ket maysa idi a naladaw a Romantiko nga Austriano a kompositor ken maysa kadagiti mangidadaulo a konduktor iti kaputotanna. Isu ket nayanak idiay purok ti Kalischt, Bohemia ken isu idi ti Austriano nga Imperio, nga itan ket ti Kaliště iti Republika a Tseka. Ti pamilia idin ket immalis idiay asideg ti Iglau nga idiay ti dimakkelan ni Mahler. <END>"
Gene Kelly,"<START> Ni Eugene Curran 'Gene' Kelly ket maysa idi nga Amerikano-Irlandes a sumasala, aktor, kumakanta, direktor ti pelikula, produser ken koreograpo. Isu ket ammo para iti enerhetiko ken atletiko nga estilo iti panagsala, ti guapona, ken dagiti kinaynayat a karakter ngainladawanna iti iskrin. <END>"
Giacomo Puccini,<START> Ni Giacomo Puccini ket maysa idi nga Italiano a kompositor a dagiti operana ket dagiti kankanayon a maipabpabuya iti pagalagadan a repertorio. <END>
Franz Schubert,<START> Ni Franz Peter Schubert ket maysa idi nga Austriano a kompositor. <END>
Igor Stravinsky,"<START> Ni Igor Fyodorovich Stravinsky ket maysa idi a Ruso, ken kalpasan daytoy ket maysa a Pranses ken Amerikano a kompositor, pianista ken konduktor. Isu ket kaaduan a naipanpanunotan a kas maysa kadagiti kangrunaan ken nakaimpluensia a kompositor ti maika-20 a siglo. <END>"
Pyotr Ilyich Tchaikovsky,"<START> Ni Pyotr Ilyich Tchaikovsky, anglisado a ka ni Peter Ilyich Tchaikovsky, ket maysa idi a Ruso a kompositor a dagiti obrana ket mairaman dagiti simponia, dagiti konsierto, dagiti opera, dagiti balet, ken kamara amusika. Adda kadagitoy ket dagiti kadayegan a konsierto ken teatriko a musika iti klasiko a repertorio. Isu ti immuna a Ruso a kompositor a ti musikana ket nakaaramid ti napaut nga impresion ti sangalubongan, nga isu ket nangipadayeg kadagiti panagpabpabuyana a kas bisita a konduktor kadagiti kinaudi a karerrna idiay Europa ken Estados Unidos. Maysa kadagiti panagpabuyana ket idiay immuna akonsierto ti Carnegie Hall idiay Siudad ti New idi 1891. Ni Tchaikovsky ket napadayawan idi 1884 babaen ti Tsar a ni Alejandro III, ken nagunggunaan ti pension ti kabibiagna idi naladaw a tawtawen ti 1880. <END>"
Giuseppe Verdi,"<START> Ni Giuseppe Fortunino Francesco Verdi ket maysa idi nga Italiano a Romantiko a kompositor, a nagnangruna iti opera. Adda dagiti temana ket napauten a nakaramut ti nadayeg a kultura – a kas ti 'La donna è mobile' manipud iti Rigoletto, 'Va, pensiero' manipud iti Nabucco, 'Libiamo ne' lieti calici' manipud iti La traviata ken ti 'Nadayag a Martsa' manipud iti Aida. <END>"
Reynaldo A. Duque,"<START> Ni Reynaldo Arquero Duque, ket maysa a multilingual a mannurat nga Ilokano. Isu ti sigud a hepe-nga-editor ti Liwayway, ti kangrunaan a linawas a (Tagalog) a magasin iti Filipinas. Maysa a piktionista, nobelista, mannaniw, dramaturgo, scriptwriter iti radio/TV/movie, editor, ken agipatpatarus. <END>"
Jacques Cartier,"<START> Ni Jacques Cartier ket maysa idi a Pranses nga eksplorador ti kaputotan a Breton a nagtunton ti Kanada para iti Pransia. Isu idi ti immuna nga Europeano a nagipalpalawag ti mapa ti Golpo ti San Lorenzo ken dagiti igid ti Karayan San Lorenzo, nga inpanagananna 'Ti Pagilian dagiti Kanada', manipud ti nagnagan nga Iroquois para kadagiti dua a dakkel a pagtaengan a nakitana idiay Stadacona ken idiay Hochelaga. <END>"
Christopher Columbus,"<START> Ni Christopher Columbus ket maysa idi nga eksplorador, kolonisador,ken nabigador, a naipasngay idiay Republika iti Genoa, a tatta nga aldawen ket ti akin-laud a Italia. Babaen ti panagikeddeng dagiti Katoliko a monarkia iti Espania, isu ket nakakompleto kadagiti uppat a panagdaliasat iti ballasiw ti Taaw Atlantiko a nangiturong ti sapasap a Europeano a panakaamoan dagiti Amerikano a kontinente. Dagitoy a panagdaliasat, ken dagiti ganetgetna a mangipatakder kadagiit agtultuloy a pagtaengan idiay isla ti Hispaniola, ket nangirugi ti panmay-an ti Espaniol a kolonisasion, a nagisakbayan ti sapasap a Europeano a kolonisasion a nagbalin a naamammoan a kas ti 'Baro a Lubong'. <END>"
James Cook,"<START> Ni Kapitan James Cook, FRS, RN ket maysa idi a Britaniko nga eksplorador, nabigador, kartograpo, ken kapitan ti Naarian a Marina. Ni Cook ket nagaramid kadagiti naisalaysayan a mapa ti Newfoundland sakbay a napan kadagiti tallo a panagbanbaniaga ti Taaw Pasipiko, nga iti las-ud ti daytoy ket nakagun-od ti immuna a Europeano a panakaiyasideg ti akin-daya nga aplaya ti Australia ken ti Is-isla ti Hawaiia, ken ti immuna a nairehistro a panagbaniaga ti likmut ti Baro a Selanda. <END>"
Hernán Cortés,"<START> Ni Hernán Cortés de Monroy y Pizarro, Umuna a Markes ti Ginget ti Oaxaca ket maysa idi a Espaniol a Konkistador a nangidaulo ti ekspedision a gapuanan ti panakatnag ti Asteka nga Imerio ken nagiyeg kadagiti dakkel a paset ti kangrunaan a daga ti Mehiko babaen ti turay ti Ari ti Kastila idi nasapa a maika-16 a siglo. Ni Cortés ket paset idi ti kaputotan dagiti Espaniol a nagkolkolonisado a nagrugian ti umuna a paset ti Espaniol a kolonisasion ti Kaamerikaan. <END>"
Yuri Gagarin,"<START> Ni Yuri Alekseyevich Gagarin ket maysa idi a Sobiet a piloto ken kosmonauta. Isu idi ti immuna a tao a nagbanniaga a napan idiay akin-ruar a limbang, idi ti Vostok a lugan ti limbang ket nakalpas ti maysa a pagliklikmutan ti Daga idi 12 Abril 1961. <END>"
Vasco da Gama,"<START> Ni D. Vasco da Gama, Umuna a Konde ti Vidigueira, ket maysa idi a Portuges nga eksplorador, maysa kadagiti kaballigian iti Panawen ti Panagduktal ken ti agbilbilin kadagitiimmuna a bapor a dagus a naglayag manipud idiay Europa aginggana idiay India. <END>"
