Title,First Paragraph
Nicole Kidman,"<START> Ni Nicole Mary Kidman, AC ket maysa nga Australiana nga aktres ken produser ti pelikula. Dagiti papel a nagpadayeg kenni Kidman dagiti pelikula idi 1989 iti Dead Calm ken dagiti serye ti telebision iti Bangkok Hilton. Isu ket nagparparang kadagiti nadumaduma a pelikula kadagiti nasapa a tawen ti 1990, ken nagabalin a nabigbigan iti sanglubongan para kadagiti panangiladawanna iti pelikula ti Days of Thunder (1990), ti Far and Away (1992), ken ti Batman Forever (1995). Dagiti dadduma pay a nagballigi a pelikula ket simmaruno kadagiti naladaw a tawen ti 1990. Ti panangiladawanna iti musikal iti Moulin Rouge! (2001) ket isu ti nakagun-odanan iti maikadua a Gunguna ti Nabalitokan a Globo para iti Kalaingan nga Aktres – Musikal ti Pelikula wenno Komedia ken ti immuna a nominasionna para iti Kalaingan nga Aktres. Ti panangiladawan ni Kidman a kas ni Virginia Woolf iti drama a pelikula ti The Hours (2002) ket nakaawat iti nasayaat a pannakabigbig ken nakagun-odanna iti Kalaingan nga Aktres, ti Gunguna ti BAFTA para iti Kalaingan nga Aktres iti Pangyuna a Papel, ti Gunguna ti Nabalitokan a Globo para iti Kalaingan nga Aktres – Drama ti Pelikula ken ti Gunguna ti Piesta ti Pelikula ti Berlin para iti Kalaingan nga Aktres iti Internasional a Piesta ti Pelikula ti Berlin. <END>"
Pierre Curie,"<START> Ni Pierre Curie ket Pranses a pisiko, pionero iti kristalograpia, magnetismo, piezoelektrisidad ken radioaktibidad. Idi 1903, isu ken kakuyogna ti asawana a ni Marie Skłodowska Curie ken ni Henri Becquerel ket nagungunaan ti Premio Nobel iti Pisika, 'iti pannakabigbig kadagiti ektraordinario a serbisio kadagiti kimmadduanda a panagsukimat a naduktalan babaen ni Propesor Henri Becquerel'. <END>"
Luciano Pavarotti,"<START> Ni Luciano Pavarotti, ket maysa idi nga Italiano a tenor iti opera a napan met iti popular a musika, ken kanungpalan a nagbalin a maysa kadagiti kaballigian a tenor a maipapan iti komersio iti amin a panawen. Isu ket nagaramid kadagiti adu a rekording kadagiti kompleto nga opera ken dagiti agmaymaysa nga aria, ken nakagun-od iti sangalubongan a kadayeg para iti kalidad iti tonona, ken kanungpalang a nagitakder iti bagina a kas maysa kadagiti kalaingan a tenor iti maika-20 a siglo. <END>"
Mikhail Ulyanov,<START> Ni Mikhail Alexandrovich Ulyanov ket maysa idi a Sobiet ken Ruso nga aktor ken maysa kadagiti kaaduan a mabigbigan a tao kalpasan ti Sangalubongan a Gubat II a teatro ken sinema ti Sobiet. Isu ket nanaganan a kas Artista ti Tattao ti USSR idi 1969 ken nakaawat iti espesial a premio manipud iti Piesta ti Pelikula ti Venice idi 1982. <END>
T. S. Eliot,"<START> Ni Thomas Stearns Eliot, ammo a kas T. S. Eliot,, ket maysa a nayanak nga Amerikano a mannaniw, dramaturgo, ken kritiko iti literatura, a dagiti obrana a kas iti 'Ti Kanta ti Ayat ni J. Alfred Prufrock', 'Ti Langalang a Daga' ken 'Uppat a Kakapat', ket mabigbig kas dadakkel a gapuanan iti maika-20 a siglo a Modernista a daniw. <END>"
Natalie Portman,"<START> Ni Natalie Portman ket maysa nga aktres, produser ti pelikula ken direktor ti pelikula nga adaan iti dua a pannakaumili iti Amerika ken Israel. Ti immuna a papelna ket idi 1994 iti Léon: The Professional, a kaduana ni Jean Reno. Kalpasanna isu ket nagpapel a kas ni Padmé Amidala iti Star Wars prequel trilogy. <END>"
Masiela Lusha,"<START> Ni Masiela Lusha ket Albanes-Amerikana nga aktres, mannaniw, ken nobelista. <END>"
Gregor Mendel,"<START> Ni Gregor Johann Mendel ket maysa idi nga agsasao ti Aleman a Silesiano a sientista ken Agostino a prayle a nagbalin a nalatak idi pimmusay a kas ti nagpundar ti baro a siensia ti henetika. Ni Mendel ket nangipakpakita ti tawid dagiti naisangayan a kababalin kadagiti mula a pisum sativum ket sumursurot kadagiti naisangayan a tabas, nga itan ket naibagbaga a kas dagiti linteg ti Mendeliano a tawid. Ti natukok a kinapangruna ti obra ni Mendel ket saan a nabigbigan aginggana idi sikko ti maika-20 a siglo, idi ti nawaya a pannakaduktal manen kadagitoy a linteg a nakairugian ti siensia ti henetika. <END>"
Jejomar Binay,"<START> Ni Jejomar 'Jojo' Cabauatan Binay, Sr., ket ammo pay a kas ni Jojo Binay wenno VPNay, ket maysa a Filipino a politiko nga isu ti maika-13 a Bise Presidente ti Filipinas manipud idi 2010. Isu ket dati a, Mayor iti Siudad ti Makati manipud idi 1986 aginggana idi 1998 ken manen idi 2001 aginggana idi 2010. Isu pay ti Presidente ti Nagkaykaysa a Suppiatan (UNO), Presidente ti Partido Demokratiko Filipino-Lakas ng Bayan (PDP-Laban), Mangipangulo ti Asia-Pasipiko a Rehion a Komite ti Eskawt, ken ti Presidente iti Eskawt dagiti Lallaki iti Filipinas. <END>"
Innokenty Smoktunovsky,<START> Ni Innokenty Mikhaylovich Smoktunovsky ket maysa idi a Sobiet ng aktor nga ammo a kas ti 'ari dagiti Sobiet nga aktor'. Isu ket nanaganan a kas Artista ti Tattao ti USSR idi 1974. <END>
Herta Müller,"<START> Ni Herta Müller ket maysa nga Aleman-Romano a nobelista, mannaniw, manalaysay ken nagungunaan ti Premio Nobel iti Literatura idi 2009. Isu ket naipasngay idiay Nițchidorf, Kondado ti Timiș idiay Romania, ti patneng a pagsasaona ket Aleman. Manipud idi nasap a a tawtawen ti 1990 isu idin ket kaaduanen a naamammuan iti sangalubongan, ken dagiti obrana ket naipatarusen kadagit ad-adu ngem duapulo a pagsasao. <END>"
Betty Gofman,"<START> Ni Betty Gofman ket maysa nga aktres iti teatro, pelikula ken telebision manipud idiay pagilian ti Brasil. Isu ket nagsanay ti teatro idiay Laranjeiras a Balay ti Arte. <END>"
Leonardo DiCaprio,"<START> Ni Leonardo Wilhelm DiCaprio ket maysa nga Amerikano nga aktor ken produser ti pelikula. Kadagiti nasapa a tawen ti 1990, inrugi ni DiCaprio ti karerna babaen ti panagparang kadagiti komersial ti telebision, kalpasanna adda met dagiti nagtultuloy a papelna iti telebission a kas ti soap opera iti Santa Barbara aken ti sitcom ti Growing Pains. Idi 1993, nangrugi ni DiCaprio iti karerna iti pelikula babaen ti panagbidana a kas ni Josh iti Critters 3, sakbay a nagbida iti panangibatay iti pelikula ti kronolohia ti This Boy's Life (1993) a kaduna ni Robert De Niro. Napammadayawan ni DiCaprio iti pangsuporta a papelna iti drama ti What's Eating Gilbert Grape (1993), ken nakagun-od iti publiko a pannakabigbig kadagiti panagbida a papel iti drama ti The Basketball Diaries (1995), ken ti roamtiko a drama ti Romeo + Juliet (1996), sakbay a nakagun-od iti sangalubongan a kadayeg iti epiko a romasia ni James Cameron iti Titanic (1997), a nagbalin nga iti kaaduan a nagganansia a pelikula iti dayta a punto. <END>"
Ramón Menéndez Pidal,"<START> Ni Ramón Menéndez Pidal ket maysa a pilologo, historiador, polklorista, ken mediebalista nga Español. Isu ket nagadal ti adu para iti Pagsasao nga Espaniol ken ti polklore ti Espania. Ti sentro nga inobrana ket ti sarita ni El Cid. <END>"
George Lucas,"<START> Ni George Walton Lucas, Jr. ket maysa nga Amerikano a direktor ti pelikula, produser, kenmannurat ti senario a nalatak gapu iti epikona a pelikula a Star Wars ken dagiti pelikula ti Indiana Jones. <END>"
Basshunter,"<START> Ni Basshunter, Jonas Erik Altberg ket Sueko a kumakanta, produser ti rekord ken DJ. <END>"
William Faulkner,"<START> Ni William Cuthbert Faulkner, naam-ammuan pay a kas ni Will Faulkner, ket maysa idi nga Amerikano a mannurat ket Premio Nobel a Laureado manipud idiay Oxford, Mississippi. Ni Faulkner ket nagobra kadagiti nadumaduma a naisursurat a midia, a mairaman kadagiti nobela, dagiti ababa a sarita, ti pabuya, dandaniw, salaysay ken dagiti senario a pabuya. Isu ket nagruna a naam-ammuan ket nabigbigan para kadagiti nobela ken dagiti ababa a saritana, ken adu kadagitoy ket naidisso iti binalabala a Kondado ti Yoknapatawpha, ti maysa a lugar a pinartuat ni Faulkner a naibatay iti Kondado ti Lafayette, nga idiay ti kaaduan a nagnaedanna, ken idiay Holly Springs Kondado ti Marshall. <END>"
Jo Jung-suk,<START> Ni Jo Jung-suk ket taga-Abagatan a Korea nga aktor. <END>
Bob Dylan,"<START> Ni Bob Dylan ket maysa nga Amerikano a kumakanta-mannurat ti kanta, artista ken mannurat, ken laureado ti Nobel. Isu ket impluensial iti popular a musika ken kultura kadagiti ad-adu ngem lima a dekada. Kaaduan kadagiti naselebraduan nga obrana ket napetsado manipud kadagiti tawtawen ti 1960 idi dagiti kantana ket ket nangikronologo iti yaalsa a sosial, urayno ni Dylan ket nangsuppiat kadagiti singasing manipud kadagiti agiwarwaranak nga isu idi ti ngiwat ti kaputotanna. Urayno kasta, dagiti nasapa a kanta a kas ti 'Blowin' in the Wind' ken 'The Times They Are a-Changin'' ket nagbalinda nga antema para kadagiti tignay ti paisano a karkarbengan ti Amerikano ken kontra-gubat. Dagiti liriko ni Dylan ket nangiraman kadagiti nadumaduma nga impluensia iti politika, sosial, pilosopia, ken literatura. <END>"
John Steinbeck,"<START> Ni John Ernst Steinbeck, Jr. ket maysa idi nga Amerikano a mannurat. Isu ket kaaduan a naamammuan para iti nobel a nangabak ti Premio Pulitzer Prize iti Ti Pungtot dagiti Ubas (1939), Daya ti Eden (1952) ken ti nobela tiDagiti Bao ken Lallaki (1937). Isu ket nagsurat kadagiti duapulo ket pito a libro,mairaman dagiti sangapulo ket innem a nobela, innem a saan apiksion a liblibro, ken lima nga urnong dagiti ababa a sarita, ni Steinbeck ket nagungunaan ti Premio Nobel iti Literatura idi 1962. <END>"
Grace Kelly,"<START> Ni Grace Patricia Kelly ket maysa idi nga Amerikana ng aktres, a kalpasan iti pannakiasawana kenni Prinsipe Rainier III idi Abril 1956, ket nagbalin a Prinsesa ti Monaco. <END>"
Penélope Cruz,<START> Ni Penélope Cruz Sánchez ket Espaniol nga aktres ken modelo. <END>
Jack Nicholson,"<START> Ni John Joseph 'Jack' Nicholson ket Amerikano nga aktor ken agpatpataud iti pelikula, ken ti karerna ket agpauten kadagiti gangani a 60 a tawen. Isu ket ammo para iti panangiladawan kadagiti nadumaduma a bida ken mangsuporta a papel, a mairaman ti satiriko a komedia, romansia ken dagiti nangisit a panangiladawan ti managrag-o a sikopatiko a karkarakter. <END>"
Mario Vargas Llosa,"<START> Ni Jorge Mario Pedro Vargas Llosa, Umuna a Markes iti Vargas Llosa ket maysa a Peruano a mannurat, politiko, agiwarwarnak, manalaysay, propesor ti kolehio, ken nagungunaan ti Premio Nobel iti Literatura idi 2010. Isu ket naipasngay idi idiay Peru, ni Vargas Llosa ket maysa kadagiti kalaingan a nobelista ken manalaysay iti Latin nga Amerika, ken maysa kadagiti mangyuna a mannurat iti kaputotanna. Adda met dagiti kritiko a nangikeddeng kaniana nga isu ket addaan ti dakkel nga impakto iti sangalubongan ken ngem ti ania man a mannurat iti Latin American Boom. Kalpasan ti pannakairangarang ti Premio Nobel iti Literatura idi 2010, ti Sueko nga Akademia ket kinunana a nangited kenni Vargas Llosa 'para iti kartograpiana kadagiti estrukrura iti bileg ken dagiti naintrinsera a ladawan dagiti resistansia ti tattao, rebolto, ken pannakaabak'. Ni Vargas Llosa ket agdama nga agbisbisita a Propesor idiay Sentro ti Lewis para kadagiti Arte idiay Unibersidad ti Princeton. <END>"
W. B. Yeats,<START> Ni William Butler Yeats ket maysa idi nga Irlandes a mannaniw ken maysa kadagiti kangrunaan a pigura iti literatura ti maika-20 a siglo. <END>
Joan Crawford,"<START> Ni Joan Crawford, ket maysa idi nga Amerikana nga aktres iti pelikula ken telebision a nangrugi a kas sumasala ken showgirl iti entablado. Idi 1999, inranggo ti American Film Institute ni Crawford a maikasangapulo iti listaanda iti kalatakan a babai nga artista iti Sinema ti Klasiko a Hollywood. <END>"
Julia Roberts,"<START> Ni Julia Fiona Roberts ket maysa nga Amerikana nga aktres ken produser. Isu ket nagbalin nga artista iti Hollywood kalpasan iti panagbidana iti romatiko a komedia iti Pretty Woman (1990), a nakalako iti $464 a riwriw iti sangalubongan. Isu ket nangabak iti tallo a Gunguna ti Nabalitokan a Globo, ken nainominadon para kadagiti uppat a Gunguna ti Akademia para iti panagartena iti pelikula, ken nangabak iti Kalaingan nga Aktres para iti panangiladawanna iti Erin Brockovich (2000). <END>"
John Wayne,"<START> Ni Marion Mitchell Morrison, kaaduan nga ammo iti naganna iti entablado a kas John Wayne ken babaen tibirngasna a 'Duke', ket maysa idi nga Amerikano nga aktor iti pelikula, direktor, ken produser. Nangabak iti Gunguna ti Akademia para iti True Grit (1969), ni Wayne ket maysa idi kadagiti kaaduan a mangaw-awis iti panagtagilako iti sine para kadagiti tallo a dekada. Maysa nga agpapaut a simbolo ti Amerikano, para kadagiti nadumaduma a kaputotan ti Amerikano isu ket pokpoken ti nagubsang a makulinidad ken nadayeg para iti panagkukuana, a mairaman iti naisangayan a natalna a boses, pagna ken katayag. <END>"
Sandra Bullock,"<START> Ni Sandra Annette Bullock ket maysa nga Amerikana nga aktres ken produser. Isu ket maysa kadagiti kanginaan ti bayad nga aktres, ken nangabak iti Gunguna ti Akademia ken Gunguna ti Banalitokan a Globo. <END>"
Knut Hamsun,"<START> Ni Knut Hamsun ket maysa idi a Norwego a mannurat, a nagunggunaan ti Premio Nobel iti Literatura idi 1920. Nadayawan isuna babaen ni Ari Haakon VII iti Norwega a kas ti Kararua ti Norwega. <END>"
Doris Lessing,"<START> Ni Doris May Lessing ket maysa idi a Britaniko a nobelista, mannaniw, daramaturgo, libretista, biograpo ken mannurat ti ababa a sarita. Dagiti nobelana ket mairaman ti Ti Ruot ket Agkankanta (1950), ti sinaruno dagiti lima nga urnong ti nobela a tinawtawagan ti Annak ti Ranggas (1952–69), Ti Nabalitokan a Kuaderno (1962), Ti Nasayaat a Terorista (1985), ken dagiti lima nga urnong ti nobela a naamammuan iti Canopus idiay Argos: Dagiti Arkibo (1979–1983). <END>"
Werner Heisenberg,"<START> Ni Werner Karl Heisenberg ket Aleman a teoretikal a pisiko ken maysa kadagiti nangruna a pionero ti mekanika kuantum. Isu ket nangipablaak iti obrana idi 1925 iti baro a papel. Kadagiti simmaruno a serye dagiti papel kada Max Born ken Pascual Jordan, iti las-ud ti isu met laeng a tawen, daytoy a pormulasion ti matrix ti mekanika kuantum ket kaaduan idi a naipalawag. Idi 1927 inpablaakna ti bukodna a pamunganayan ti panagdudua, ken dayta ti nangitakderanna ti pilosopiana ken ti kaaduan a pammakaammo kaniana. Ni Heisenberg ket nagungunaan ti Premio Nobel iti Pisika idi 1932 'para iti panagpartuat ti mekanika kuantum'. Isu ket nangruna pay a nagkontribusion kadagiti teoria iti hidrodinamika dagiti nagulo nga ayus, ti tengnga ti atomiko, ferromagnetismo, kosmiko a rayraya, ken dagiti subatomiko a partikula, ken instrumental pay iti panagplano ti immuna a reaktor ti atomiko ti Laud nga Alemania idiay Karlsruhe, ken kakuyog ti panagsukisok ti reaktor idiay Munich, idi 1957. <END>"
Harold Pinter,"<START> Ni Harold Pinter ket maysa a Britaniko a mannurat, dramaturgo, ken direktor ti teatro ken pelikula. Napadayawan iti Premio Nobel iti Literatura idi 2005. <END>"
Jane Fonda,"<START> Ni Jane Fonda ket Amerikana nga aktres, mannurat, aktibista iti politika, dati a modelo iti moda ken guru iti kinasalun-at. Isu ket namindua a nangabak iti Gunguna ti Akademia ken namindua a beses a nangabak iti Premio BAFTA. Idi 2014, isu ket nagungunaan iti AFI Life Achievement Award ti American Film Institute. <END>"
Al Pacino,"<START> Ni Alfredo James 'Al' Pacino ket maysa nga Amerikano nga aktor ti entablado ken pelikula, agpatpataud iti pelikula, ken mannurat iti senario. <END>"
Demi Lovato,<START> Ni Demetria Devonne 'Demi' Lovato ket maysa nga aktres ken kumakanta manipud idiay Estados Unidos. <END>
Boris Pasternak,"<START> Ni Boris Leonidovich Pasternak ket maysa idi a nobelista, mannaniw, ken agipatpatarus ti literatura iti pagsasao a Ruso. Idiay katutubo na a Rusia, ti antolohia ni Pasternak a Ti Kabsat ko a Babai, Ti Biag ko, ket maysa kadagiti kaimpluensian nga urnong a naipablaak iti Pagsasao a Ruso. Ken dagiti teatriko nga impatarusna a Goethe, Schiller, Pedro Calderón de la Barca, ken William Shakespeare ket agnanayon a nasiglat kadagiti agbuybuya a Ruso. <END>"
Henri Becquerel,"<START> Ni Antoine Henri Becquerel ket Pranses a pisiko, Nobel laureado, ken ti nangduktal ti radioaktibidad a kakuyogna ni Marie Skłodowska-Curie ken ni Pierre Curie, nga isuda a tallo ket nagungunaan ti Premio Nobel iti Pisika idi 1903. <END>"
John Dalton,"<START> Ni John Dalton  ket maysa idi nga Inggles a kimiko, meteorologo ken pisiko. Isu ket kaaduan a naamammuan para kadagiti pionero nga obrana iti panagrang-ay ti moderno a teoria ti atomiko. <END>"
Jodie Foster,"<START> Ni Alicia Christian 'Jodie' Foster ket maysa nga Amerikana nga aktres, direktor ken produser a nagobra kadagiti pelikula ken iti telebision. Isu ket masansan a madakdakamat a kas maysa kadagiti kalaingan nga aktres iti henerasionna. Inrugi ni Foster ti pagsapulanna idi agtawen iti tallo a kas modelo nga ubing idi 1965, ken kalpasan ti dua a tawen, napan nagarte kadagiti serye ti telebision, iti sitcom ti Mayberry R.F.D. ti immuna nga inaramidna. Kadagiti naladaw a tawen ti 1960 ken dagiti nasapa a tawen ti 1970, isu ket nagtrabaho kadagiti nadumaduma a serye ti primetime telebision ken nagbida kadagiti pelikula ti ubbing. Ti kaaduan a nakaammuan kenni Foster ket iti Taxi Driver (1976) ni Martin Scorsese, a nagpapel iti datoy a kas agtutubo a pampam; ti papelna iti daytoy ket nakaawatanna ti nominasion para iti Gunguna ti Akademia. <END>"
Wole Soyinka,"<START> Ni Akinwande Oluwole 'Wole' Soyinka ket maysa a Nigeriano a mannurat, mannaniw ken dramaturgo. Nagunggunaan isuna idi 1986 ti Premio Nobel iti Literatura, a nabigbigan isuna a kas maysa a tao nga 'addaan ti nalawa a kultural a perspektibo ken addaan dagiti moda a kapanunutan a panagdaniw ti drama iti panagbiag', ken isu ti immuna nga Aprikano ken idiay Diaspora a napadayawan. Idi 1994, isu ket nainaganan ti UNESCO a maysa a Naimbagan ti Nakem nga Embahador para iti panagipangato iti Aprikano a Kultura, karbengan dagiti nagtagitaoan, nawaya a panagyebkas, midia ken pannakisarita. <END>"
Henryk Sienkiewicz,"<START> Ni Henryk Adam Aleksander Pius Sienkiewicz ket maysa idi a Polako nga agiwarwarnak, nangabak iti Premio Nobel a nobelista, ken pilantropo. Isu ket kaaduan a nailaglagipan para kadagiti bukodna a naipakasaritaan a nobela. <END>"
David Hilbert,"<START> Ni David Hilbert, ForMemRS ket maysa idi nga Aleman a matematiko. Isu ket nabigbigan a kas maysa kadagiti kaimpluensiaan ken dagiti unibersal a matematiko iti maika-19 a siglo ket ti nasapa a maika-20 a sigsiglo. Ni Hilbert ket isu ti nakaduktal ken nangirang-ay kadagiti nawatiwat a sakop kadagiti kammasapulan a kapanunotan kadagiti adu a pagobraan, a mairaman ti di agdumaduma a teoria ken ti aksiomasisasion iti heometria. Isu pay ti nangiyannurot ti teoria dagiti limbang ni Hilbert, maysa kadagiti pundasion ti maiyannnong a panagusig. <END>"
Christina Aguilera,<START> Ni Christina Aguilera ket maysa nga aktres ken kumakanta manipud idiay Estados Unidos. <END>
Sixto Brillantes,"<START> Ni Sixto Serrano Brillantes, Jr. ket isu ti idi ti mangipangulo ti Komision dagiti Eleksion (Comelec). Isu ket indutok babaen ni Presidente Benigno Aquino III idi Enero 16, 2011 tapno agserbi ti saan pay a nagpaso a termino ni Mangipagulo Jose Melo. <END>"
Hendrik Lorentz,<START> Ni Hendrik Antoon Lorentz ket maysa idi nga Olandes a pisiko a nakibinningay kenni Pieter Zeeman ti Premio Nobel iti Pisika idi 1902 para iti panagduktal ti teoretio a pannakaipalawag ti epekto ni Zeeman. Pinataudna pay dagiti ekuasion ti transpormasion a kanungpalan nga inusar a panangipalawag babaen ni Albert Einstein ti espasio ken panawen. <END>
Paul Newman,"<START> Ni Paul Leonard Newman ken maysa idi nga Amerikano nga aktor, direktor ti pelikula, negosiante, propesional a nga agpalpalumba iti lugan ken agtagikua, ebironmentalista, aktibista ken pilantropo. Isu ket nangabak kadagit inadumaduma a gunguna, mairaman ti maysa a Gunguna ti Akademia para iti panangiladawanna iti pelikula idi 1986 itiThe Color of Money, ti BAFTA Award, ti Screen Actors Guild Award, ti Gunguna ti Cannes Film Festival, maysa nga Emmy Award, ken dagiti adu nga honorario a gunguna. <END>"
J. M. G. Le Clézio,"<START> Ni Jean-Marie Gustave Le Clézio, kadawyan a nainaganan a kas ni J. M. G. Le Clézio, ket Pranses-Mauritiano a mannurat ken propesor. Ti nagsurat kadagiti sumurok nga uppat a pulo nga obra, isu ket nagunggunaan ti Prix Renaudot idi 1963 para iti nobelana a Le Procès-Verbal. <END>"
Denzel Washington,"<START> Ni Denzel Hayes Washington, Jr. ket maysa nga Amerikano nga aktor ken agpatpataud iti pelikula. Isu ket nakaawat kadagiti tallo a gunguna ti Golden Globe, maysa a Gunguna ti Tony, ken dua a Gunguna ti Akademia: Kalaingan a Suporta nga Aktor para iti historikal a drama ti gubat a pelikula ti Glory (1989) ken Kalaingan nga Aktor para iti papelna iti Training Day (2001). <END>"
Tomas Tranströmer,"<START> Ni Tomas Gösta Tranströmer ket maysa a Sueko mannaniw, sikologo ken agipatpatarus. Dagiti daniwna ket makatiliw kadagiti napaut a panaglalam-ek iti Suesia, ti ritmiko dagiti panawen ken ti makarikna, atmosperiko a kapintas ti katutubo. Ti obra ni Tranströmer ket nailasin pay babaen ti rikna iti misterio ken siddaaw a nakaipanan ti kankanayon nga inaldaw a biag, ti kualidad a masansan a makaited kadagiti daniwna iti relihioso a dimension. Agpayso nga isu ket naibagbaga a kas maysa a Kristiano a a mannaniw. <END>"
Henri Bergson,"<START> Ni Henri-Louis Bergson ket maysa a kangrunaan a Pranses a pilosopo, a kangrunaan a nakaimpluensia iti immuna a kagudua iti maika-20 a siglo. <END>"
Sully Prudhomme,"<START> Ni René François Armand Prudhomme ken maysa a mannaniw ken mannurat a Pransés, anak iti maysa nga tiendero. Isu iti umuna nga napadayawan iti Premio Nobel iti Literatura idi 1901. Nagbasa isuna para iti kinainheniero ngem simmardeng gapu iti pinagsakit ti matana. Iti literatura garud iti insublatna nga inadal. Simmali a miembro ni Prudhomme iti Conférence La Bruyère, gimong dagiti nalatakan nga estudiante idiay Pransia ket iti pinagaseptarda iti sursuratna iti nagrugiananna a nagsurat iti dandaniw. <END>"
Miley Cyrus,<START> Ni Destiny Hope Cyrus ket maysa nga aktres ken kumakanta manipud idiay Estados Unidos. <END>
Mikhail Sholokhov,<START> Ni Mikhail Aleksandrovich Sholokhov ket maysa idi a Sobiet/Ruso a nobelista ken nagunggunaan ti Premio Nobel iti Literatura idi 1965. <END>
Andrea Bocelli,"<START> Ni Andrea Bocelli,(Panangibalikas nga Italiano‎: [anˈdrɛːa boˈtʃɛlli]; nayanak idi 22 Septiembre 1958) ket maysa nga Italiano a kumakanta ti klasikal, ken mannurat ti kanta. Naiyanak a saan a nasayaat a makakita, isu ket permanente a nagbulsek idi agtawen iti 12 kalpasan ti aksidente iti putbol. <END>"
Anatole France,"<START> Ni Anatole France, naipasngay a kas François-Anatole Thibault, [frɑ̃swa anatɔl tibo], ket maysa a Pranses a mannaniw, agiwarwarnak, ken nobelista. Naipasngay idiay Paris, ken pimmusay idiay Saint-Cyr-sur-Loire.Isu ket maysa a naim-balligian a nobelista, nga addaan kadagiti kalaingan a nailaklako. Isuna ket kameng iti Académie française, ken nangabak ti Premio Nobel iti Literatura para iti panakaibigbigan kaniana kadagiti kagun-odan na iti literatura. <END>"
Björk,"<START> Ni Björk Guðmundsdóttir ket maysa a taga-Islandia a kumakanta ken kompositor, nga addaan iti dadakkel kinaykayat iti adu a kita ti musika a pakairamanan ti pop, trip hop, alternatibo a rock, jazz, ambiento a musika, elektronika, folk, ken klasikal a musika. <END>"
Katy Perry,"<START> Ni Katheryn Elizabeth Hudson, naarartap a maammuan ti nagan na iti entablado a Katy Perry, ket maysa nga Amerikana a kumakanta, manursurat ti kanta ken aktres. Naipasngay idiay Santa Barbara, California, ken dimmakkel a kas maysa a Kristiano babaen dagiti pastor a nagannak, ni Perry ket dimmakkel a dumdumngeg iti ebanghelio a musika laeng ken nagkankanta idiay simbaanna idi ubing. Kalpasan a nakaala ti GED idi umuna a tawenna iti nangato a panagadal, nagsurot isuna ti bukodna a karrer, ken kas ni Katy Hudson impablaak na ti nainaganan kaniana nga ebanghelio a plaka idi 2001, nga daytoy ket saan a nagballigi. Nagaramid idi isuna ti maysa a plaka a nairaman ti with produksion a kappon a Ti Matrix, ken nagaramid pay isuna ti plakana nga agmaymaysa ngem daytoy ket saan met a naipablaak. Kalpasan ti panagpirmana iti Capitol Music Group idi 2007, ti maikapat a plakana iti pito nga tawen, inamponna ti entablado a naganna a kas Katy Perry. <END>"
Wisława Szymborska,"<START> Ni Wisława Szymborska, Maria Wisława Anna Szymborska ket maysa idi a Polako a mannaniw, mannalaysay, agipatpatarus ken nagungunaan iti 1996 Premio Nobel iti Literatura. Naipasngay idiay Prowent, nga itan ket nagbalin a paset iti Kórnik, kalpasan daytoy isuna ket nagtaeng met idiay Kraków agingana idi pimmusay. Nailanad isuna a kas ti 'Mozart iti Daniw'. Idiay Polonia, dagiti libro ni Szymborska ket nakadanonen iti panaglako a karibalna dagiti nalatak a mannurat ti prosa: a kinunana iti maysa a daniw, 'Adda Sabsabali a Kaykayatda ti Daniw', nga awan pay nga ad-adu ngen dua kadagiti sangagasot a tattao ket kayatda iti daytoy nga arte. <END>"
Frédéric Mistral,<START> Ni Frédéric Mistral ket maysa a mannaniw a Pransés a nangidaulo iti panangiyungar iti pagsasao a Oksitano ken iti literaturana idi siglo-19. Nagungunaan iti Premio Nobel iti Literatura idi 1904. <END>
Heinrich Böll,<START> Ni Heinrich Theodor Böll ket maysa kadagiti kangrunaan a mannurat iti Alemania iti kalpasan ti Maikadua a Sangalubongan a Gubat. Ni Böll ket nagunggunaan idi ti Premio Georg Büchner idi 1967 ken ti Premio Nobel iti Literatura idi 1972. <END>
Audrey Hepburn,"<START> Ni Audrey Hepburn ket Briton nga aktres, modelo ken humanitariano. Naipasngay isuna idiay Bruselas, Belhika, maymaysa nga anak da Joseph Anthony Ruston ken Baronesa Ella van Heemstra a maysa nga aristokrata a Olandes. Innayon ni tatangna iti apeliedo a Hepburn gapuna a nagbalin isuna nga 'Audrey Hepburn-Ruston.' <END>"
