Title,First Paragraph
George Bernard Shaw,"George Bernard Shaw, known at his insistence as Bernard Shaw, was an Irish playwright, critic, polemicist and political activist. His influence on Western theatre, culture and politics extended from the 1880s to his death and beyond. He wrote more than sixty plays, including major works such as Man and Superman (1902), Pygmalion (1913) and Saint Joan (1923). With a range incorporating both contemporary satire and historical allegory, Shaw became the leading dramatist of his generation, and in 1925 was awarded the Nobel Prize in Literature."
Yun Chi-ho,"Yun Chi-ho was a Korean politician. His name is sometimes spelled Yun Tchi-Ho, his art name was Jwaong (좌옹), and his courtesy name was Seongheum (성흠)."
Robert Johnson,"Robert Leroy Johnson was an American blues musician and songwriter. His landmark recordings in 1936 and 1937 display a combination of singing, guitar skills, and songwriting talent that has influenced later generations of musicians. Although his recording career spanned only seven months, he is recognized as a master of the blues, particularly the Delta blues style, and one of the most influential musicians of the 20th century. The Rock and Roll Hall of Fame describes him as perhaps ""the first ever rock star""."
Judy Ann Santos,"Judy Anne Lumagui Santos is a Filipino actress and film producer. Prolific in film and television in the Philippines since the early 1990s, she is known for her comedic and dramatic roles in independent films and blockbusters, as well as for her portrayals of oppressed and impoverished women. She has received various accolades, including a Cairo International Film Festival Award, a Gawad Urian, two Luna Awards, two Metro Manila Film Festival Awards, and three FAMAS Awards."
Angel Locsin,"Angelica Locsin Colmenares is a Filipino actress and humanitarian. She is known for her dramatic roles and portrayals of heroines and mythological characters in film and television. She is a recipient of various accolades, including four Star Awards, three FAMAS Awards, two Box Office Entertainment Awards, and a Luna Award."
Maya Angelou,"Maya Angelou was an American memoirist, poet, and civil rights activist. She published seven autobiographies, three books of essays, several books of poetry, and is credited with a list of plays, movies, and television shows spanning over 50 years. She received dozens of awards and more than 50 honorary degrees. Angelou's series of seven autobiographies focus on her childhood and early adult experiences. The first, I Know Why the Caged Bird Sings (1969), tells of her life up to the age of 17 and brought her international recognition and acclaim."
Al Gore,"Albert Arnold Gore Jr. is an American politician, businessman, and environmentalist who served as the 45th vice president of the United States from 1993 to 2001 under President Bill Clinton. He previously served as a United States Senator from Tennessee from 1985 to 1993 and as a member of the U.S. House of Representatives from 1977 to 1985. Gore was the Democratic nominee for president of the United States in the 2000 presidential election, which he lost to George W. Bush."
Nick Joaquin,"Nicomedes ""Nick"" Marquez Joaquin was a Filipino writer and journalist best known for his short stories and novels in the English language. He also wrote using the pen name Quijano de Manila. Joaquin was conferred the rank and title of National Artist of the Philippines for Literature. He has been considered one of the most important Filipino writers, along with José Rizal and Claro M. Recto. Unlike Rizal and Recto, whose works were written in Spanish, Joaquin's major works were written in English despite being literate in Spanish."
Josh Duhamel,"Joshua David Duhamel is an American actor. After various modeling work, he made his acting debut as Leo du Pres on the ABC daytime soap opera All My Children and later starred as Danny McCoy on NBC's Las Vegas."
Steve Jobs,"Steven Paul Jobs was an American businessman, inventor, and investor best known for co-founding the technology giant Apple Inc. Jobs was also the founder of NeXT and chairman and majority shareholder of Pixar. He was a pioneer of the personal computer revolution of the 1970s and 1980s, along with his early business partner and fellow Apple co-founder Steve Wozniak."
Lady Gaga,"Stefani Joanne Angelina Germanotta, known professionally as Lady Gaga, is an American singer, songwriter and actress. She is known for reinventing her image and showcasing versatility in entertainment. Gaga started performing as a teenager by singing at open mic nights and acting in school plays. She studied Collaborative Arts Project 21 before leaving to pursue a music career. After a contract cancellation by Def Jam Recordings, Gaga worked as a songwriter for Sony/ATV Music Publishing. In 2007, she signed with Interscope Records and KonLive Distribution. Her breakthrough came the following year with her debut studio album, The Fame, and its singles ""Just Dance"" and ""Poker Face"". The album was later reissued along with The Fame Monster (2009), which yielded the successful singles ""Bad Romance"", ""Alejandro"" and ""Telephone""."
Adriano Celentano,"Adriano Celentano is an Italian singer, songwriter, actor, and filmmaker. He is dubbed Il Molleggiato because of his energetic dancing."
Stanley Kubrick,"Stanley Kubrick was an American filmmaker and photographer. Widely considered one of the greatest filmmakers of all time, his films were nearly all adaptations of novels or short stories, spanning a number of genres and gaining recognition for their intense attention to detail, innovative cinematography, extensive set design, and dark humor."
Nur Misuari,"Nur Misuari is a Moro Filipino revolutionary and politician, founder and leader of the Moro National Liberation Front."
Ryu Jun-yeol,"Ryu Jun-yeol is a South Korean actor, activist, and photographer. Ryu began his acting career in independent films, he drew attention from the audience for his role in feature film Socialphobia (2015), where he won both the Rising Star Award at KAFA Film Festival and Chunsa Film Art Awards. He rose to international prominence through his breakthrough role in the critically acclaimed television series Reply 1988 (2015–2016), the highest-rated drama in Korean cable television history at the time, which also led to him winning various Best New Actor Awards in South Korea. Known as a prolific Chungmu-ro actor, since then he has starred in the box-office hit films The King (2017), A Taxi Driver (2017), Little Forest (2018), Believer (2018), Money (2019), The Battle: Roar to Victory (2019), and The Night Owl (2022)."
Kate Winslet,"Kate Elizabeth Winslet is an English actress. Known for her roles as headstrong and complicated women in independent films, particularly period dramas, she has received numerous accolades, including an Academy Award, a Grammy Award, two Primetime Emmy Awards, five BAFTA Awards and five Golden Globe Awards. Time magazine named Winslet one of the 100 most influential people in the world in 2009 and 2021. She was appointed Commander of the Order of the British Empire (CBE) in 2012."
Mae West,"Mary Jane ""Mae"" West was an American actress, singer, comedian, screenwriter, and playwright whose career spanned over seven decades. Considered a sex symbol, she was known for her breezy sexual independence and her lighthearted bawdy double entendres, often delivered in a husky contralto voice. She was active in vaudeville and on stage in New York City before moving to Los Angeles to begin a career in the film industry."
Brahmagupta,"Brahmagupta was an Indian mathematician and astronomer. He is the author of two early works on mathematics and astronomy: the Brāhmasphuṭasiddhānta, a theoretical treatise, and the Khaṇḍakhādyaka, a more practical text."
Spiro Agnew,"Spiro Theodore Agnew was the 39th vice president of the United States, serving from 1969 until his resignation in 1973. He is the second of two vice presidents to resign the position, the first being John C. Calhoun in 1832."
Claudette Colbert,"Émilie Chauchoin, professionally known as Claudette Colbert, was an American actress. Colbert began her career in Broadway productions during the late 1920s and progressed to films with the advent of talking pictures. Initially contracted to Paramount Pictures, Colbert became one of the few major actresses of the period who worked freelance, independent of the studio system."
Paul Ryan,"Paul Davis Ryan is an American politician who served as the 54th speaker of the United States House of Representatives from 2015 to 2019. A member of the Republican Party, he was the vice presidential nominee in the 2012 election with Mitt Romney, but they lost to incumbent President Barack Obama and Vice President Joe Biden."
Charles de Gaulle,"Charles André Joseph Marie de Gaulle was a French army officer and statesman who led the Free French Forces against Nazi Germany in World War II and chaired the Provisional Government of the French Republic from 1944 to 1946 to restore democracy in France. In 1958, amid the Algerian War, he came out of retirement when appointed Prime Minister by President René Coty. He rewrote the Constitution of France and founded the Fifth Republic after approval by referendum. He was elected President of France later that year, a position he held until his resignation in 1969."
Frances McDormand,"Frances Louise McDormand is an American actress and producer. In a career spanning over four decades, she has gained acclaim for her roles in small-budget independent films. McDormand has received numerous accolades, including four Academy Awards, two Emmy Awards, and one Tony Award, making her one of the few performers to achieve the ""Triple Crown of Acting"". Additionally, she has received three BAFTAs and two Golden Globe Awards. McDormand's worldwide box office gross exceeds $2.2 billion."
Gregorio S. Araneta,"Don Gregorio Soriano Araneta was a Filipino lawyer, businessman, and nationalist, during the Spanish and American colonial periods."
Bradley Cooper,"Bradley Charles Cooper is an American actor and filmmaker. He is the recipient of various accolades, including a British Academy Film Award and two Grammy Awards. In addition, he has been nominated for twelve Academy Awards, six Golden Globe Awards, and a Tony Award. Cooper appeared on the Forbes Celebrity 100 list three times and on Time's list of the 100 most influential people in the world in 2015. His films have grossed $13 billion worldwide, and he has been placed in annual rankings of the world's highest-paid actors four times."
Chelsea Kane,"Chelsea Kane Staub is an American actress and singer. She is best known for her role as Stella Malone in the Disney Channel sitcom television series Jonas and the role of Riley Perrin in the Freeform sitcom, Baby Daddy. She also voiced Bea Goldfishberg in the Disney Channel animated sitcom Fish Hooks."
George W. Bush,"George Walker Bush is an American politician and businessman who served as the 43rd president of the United States from 2001 to 2009. A member of the Republican Party, he previously served as the 46th governor of Texas from 1995 to 2000."
John C. Calhoun,"John Caldwell Calhoun was an American statesman and political theorist who served as the seventh vice president of the United States from 1825 to 1832. Born in South Carolina, he adamantly defended American slavery and sought to protect the interests of white Southerners. Calhoun began his political career as a nationalist, modernizer and proponent of a strong federal government and protective tariffs. In the late 1820s, his views changed radically, and he became a leading proponent of states' rights, limited government, nullification, and opposition to high tariffs. Calhoun saw Northern acceptance of those policies as a condition of the South's remaining in the Union. His beliefs heavily influenced the South's secession from the Union in 1860 and 1861. He was the first of two vice presidents to resign from the position, the second being Spiro Agnew, who resigned in 1973."
René Préval,"René Garcia Préval was a Haitian politician and agronomist who twice was President of Haiti, from early 1996 to early 2001, and again from mid-2006 to mid-2011. He was also Prime Minister from early to late 1991 under the presidency of Jean-Bertrand Aristide."
Hubert Humphrey,"Hubert Horatio Humphrey Jr. was an American politician and statesman who served as the 38th vice president of the United States from 1965 to 1969. He twice served in the United States Senate, representing Minnesota from 1949 to 1964 and 1971 to 1978. As a senator he was a major leader of modern liberalism in the United States. As President Lyndon B. Johnson's vice president, he supported the controversial Vietnam War. An intensely divided Democratic Party nominated him in the 1968 presidential election, which he lost to Republican nominee Richard Nixon."
Ellen Burstyn,"Ellen Burstyn is an American actress. Known for her portrayals of complex women in dramas, she is the recipient of numerous accolades, including an Academy Award, a Tony Award, and two Primetime Emmy Awards, making her one of the few performers to achieve the ""Triple Crown of Acting"". She has also received a BAFTA Award and a Golden Globe Award."
Whang-od,"Whang-od Oggay, also known as Maria Oggay, is a tattoo artist from the village of Buscalan within Tinglayan, Kalinga, Philippines. She is often described as the ""last"" and oldest mambabatok and is part of the Butbut people of the larger Kalinga ethnic group."
Amanda Bynes,"Amanda Laura Bynes is an American manicurist and former actress. Bynes began her career as a child, appearing on the Nickelodeon sketch comedy series All That (1996–2000) and its spin-off series The Amanda Show (1999–2002). During her mid-teens, she played Holly Tyler on the WB sitcom What I Like About You (2002–2006), Kaylee in the teen comedy film Big Fat Liar (2002) and Daphne Reynolds in the comedy film What a Girl Wants (2003), and voiced Piper Pinwheeler in the animated film Robots (2005). As an adult, she starred as Viola Hastings in the romantic comedy film She's the Man (2006), Penny Lou Pingleton in the musical film Hairspray (2007), and Marianne Bryant in the comedy film Easy A (2010)."
Joseph Estrada,"Joseph Ejercito Estrada, also known by the nickname Erap, is a Filipino politician and former actor. He served as the 13th President of the Philippines from 1998 to 2001, the 9th Vice President of the Philippines from 1992 to 1998, and the 26th Mayor of the City of Manila, the country's capital, from 2013 to 2019. In 2001, he became the first Chief Executive in Asia to be formally impeached and resigned from power. At the age of 86, he is currently the oldest living former Philippine President."
Marlee Matlin,"Marlee Matlin is an American actress, author, and activist. She is the recipient of numerous awards, including an Academy Award, a Golden Globe Award, and a Screen Actors Guild Award, in addition to nominations for a BAFTA Award, and four Primetime Emmy Awards."
Helen Hayes,"Helen Hayes MacArthur was an American actress whose career spanned 82 years. She eventually received the nickname ""First Lady of American Theatre"" and was the second person and first woman to have won an Emmy, a Grammy, an Oscar, and a Tony Award. She was also the first person to win the Triple Crown of Acting. Hayes also received the Presidential Medal of Freedom, America's highest civilian honor, from President Ronald Reagan in 1986. In 1988, she was awarded the National Medal of Arts."
Charlene Gonzales,"Charlene Mae Gonzales Bonnin-Muhlach is a Filipino actress, media personality and beauty pageant titleholder. Gonzales won the Binibining Pilipinas Universe 1994 title and represented her country at the Miss Universe 1994 pageant held in Manila, where she won the Best National Costume award and was one of the Top 6 Finalists."
John Goodman,"John Stephen Goodman is an American actor. He rose to prominence in television before becoming an acclaimed and popular film actor. Goodman has received numerous accolades including a Primetime Emmy Award, Golden Globe Award, and a Screen Actors Guild Award. He received a Disney Legend Award in 2013. Vanity Fair has called him ""among our very finest actors."""
Fidel V. Ramos,"Fidel Valdez Ramos, popularly known as FVR and Eddie Ramos, was a Filipino general and politician who served as the 12th President of the Philippines from 1992 to 1998. He was the only career military officer who reached the rank of five-star general/admiral de jure. Rising from second lieutenant to commander-in-chief of the armed forces, Ramos is credited for revitalizing and renewing international confidence in the Philippine economy during his six years in office."
Lapulapu,"Lapulapu or Lapu-Lapu, whose name was first recorded as Çilapulapu, was a datu (chief) of Mactan, an island now part of the Philippines. Lapulapu is known for the 1521 Battle of Mactan, where he and his men defeated Spanish forces led by Portuguese explorer Ferdinand Magellan and his native allies Rajah Humabon and Datu Zula. Magellan's death in battle ended his voyage of circumnavigation and delayed the Spanish occupation of the islands by over forty years until the expedition of Miguel López de Legazpi in 1564."
Maurice Béjart,"Maurice Béjart was a French-born dancer, choreographer and opera director who ran the Béjart Ballet Lausanne in Switzerland. He developed a popular expressionistic form of modern ballet, talking vast themes. He was awarded Swiss citizenship posthumously."
Georges Pompidou,"Georges Jean Raymond Pompidou was a French politician who served as President of France from 1969 to his death in 1974. He was earlier the longest-ever Prime Minister of France, under President Charles de Gaulle, from 1962 to 1968."
Antonio Villaraigosa,"Antonio Ramón Villaraigosa is an American politician who served as the 41st Mayor of Los Angeles from 2005 to 2013. A member of the Democratic Party, Villaraigosa was a national co-chairman of Hillary Clinton's 2008 presidential campaign, a member of President Barack Obama's Transition Economic Advisory Board, and chair of the 2012 Democratic National Convention."
Adam Levine,"Adam Noah Levine is an American singer and musician who serves as the lead vocalist, rhythm guitarist, and sole continuous member of the pop rock band Maroon 5."
Vilma Santos,"Rosa Vilma Tuazon Santos-Recto is a Filipino actress and politician. In a career spanning over six decades, she has played dramatic roles in film and television in the Philippines. She is widely referred as the ""Star for All Seasons"". She began her career as a child actress in the 1963 film Trudis Liit, for which she won her first FAMAS Award. She won the FAMAS Award for Best Actress for her dual role in Dama de Noche (1972). She has portrayed the superhero Darna in four films beginning with Lipad, Darna, Lipad! (1973). Santos produced Pagputi ng Uwak, Pag-itim ng Tagak (1978), which won both the FAMAS Award for Best Picture and the Gawad Urian for Best Film."
Elbridge Gerry,"Elbridge Gerry was an American Founding Father, merchant, politician, and diplomat who served as the fifth vice president of the United States under President James Madison from 1813 until his death in 1814. The political practice of gerrymandering is named after him."
Muddy Waters,"McKinley Morganfield, known professionally as Muddy Waters, was an American blues singer and musician who was an important figure in the post-World War II blues scene, and is often cited as the ""father of modern Chicago blues"". His style of playing has been described as ""raining down Delta beatitude""."
Ninoy Aquino,"Benigno ""Ninoy"" Simeon Aquino Jr., was a Filipino politician who served as a senator of the Philippines (1967–1972) and governor of the province of Tarlac. Aquino was the husband of Corazon Aquino, who became the 11th president of the Philippines after his assassination, and father of Benigno Aquino III, who became the 15th president of the Philippines. Aquino, together with Gerardo Roxas and Jovito Salonga, helped form the leadership of the opposition towards then President Ferdinand Marcos. He was the significant leader who together with the intellectual leader Sen. Jose W. Diokno led the overall opposition."
Patrick Modiano,"Jean Patrick Modiano, generally known as Patrick Modiano, is a French novelist and recipient of the 2014 Nobel Prize in Literature. He is a noted writer of autofiction, the blend of autobiography and historical fiction."
Manuel Roxas,"Manuel Acuña Roxas was a Filipino lawyer and politician who served as the fifth President of the Philippines from 1946 until his death in 1948. He served briefly as the third and last President of the Commonwealth of the Philippines from May 28, 1946, to July 4, 1946, and became the first President of the Independent Third Philippine Republic after the United States ceded its sovereignty over the Philippines."
Daniel D. Tompkins,"Daniel D. Tompkins was an American politician. He was the fourth governor of New York from 1807 to 1817, and the sixth vice president of the United States from 1817 to 1825."
P. T. Barnum,"Phineas Taylor Barnum, known professionally as P.T. Barnum was an American showman, businessman and politician remembered for promoting celebrated hoaxes and founding the Ringling Bros. and Barnum & Bailey Circus with James Anthony Bailey."
Antoine Laurent de Jussieu,"Antoine Laurent de Jussieu was a French botanist, notable as the first to publish a natural classification of flowering plants; much of his system remains in use today. His classification was based on an extended unpublished work by his uncle, the botanist Bernard de Jussieu."
Paul Scofield,"David Paul Scofield was an English actor. During a six-decade career, Scofield achieved the Triple Crown of Acting, winning an Academy Award, Emmy, and Tony for his work. Scofield established a reputation as one of the greatest Shakespearean performers. He declined the honour of a knighthood, but was appointed CBE in 1956 and became a CH in 2001."
Henrik Pontoppidan,"Henrik Pontoppidan was a Danish realist writer who shared with Karl Gjellerup the Nobel Prize for Literature in 1917 for ""his authentic descriptions of present-day life in Denmark."" Pontoppidan's novels and short stories — informed with a desire for social progress but despairing, later in his life, of its realization — present an unusually comprehensive picture of his country and his epoch. As a writer he was an interesting figure, distancing himself both from the conservative environment in which he was brought up and from his socialist contemporaries and friends. He was the youngest and in many ways the most original and influential member of the Modern Break-Through."
Tom Hanks,"Thomas Jeffrey Hanks is an American actor and filmmaker. Known for both his comedic and dramatic roles, he is one of the most popular and recognizable film stars worldwide, and is regarded as an American cultural icon. Hanks' films have grossed more than $4.9 billion in North America and more than $9.96 billion worldwide, making him the fourth-highest-grossing actor in North America. He has received numerous honors including the AFI Life Achievement Award in 2002, the Kennedy Center Honor in 2014, the Presidential Medal of Freedom and the French Legion of Honor both in 2016, as well as the Golden Globe Cecil B. DeMille Award in 2020."
Carl Spitteler,"Carl Friedrich Georg Spitteler was a Swiss poet who was awarded the Nobel Prize for Literature in 1919 ""in special appreciation of his epic Olympian Spring"". His work includes both pessimistic and heroic poems."
Donald Trump,"Donald John Trump is an American politician, media personality, and businessman who served as the 45th president of the United States from 2017 to 2021."
Geraldine Page,"Geraldine Sue Page was an American actress. With a career which spanned four decades across film, stage, and television, Page was the recipient of numerous accolades, including an Academy Award, a British Academy Film Award, two Primetime Emmy Awards, two Golden Globe Awards, and four nominations for the Tony Award."
Heart Evangelista,"Love Marie Payawal Ongpauco, known professionally as Heart Evangelista, is a Filipino actress. She is currently an exclusive artist of GMA Network and represented by Alice Talents Agency in Paris, France."
Gloria Swanson,"Gloria Josephine Mae Swanson was an American actress. She first achieved fame acting in dozens of silent films in the 1920s and was nominated three times for the Academy Award for Best Actress, most famously for her 1950 turn in Billy Wilder's Sunset Boulevard, which also earned her a Golden Globe Award."
George Washington,"George Washington was an American Founding Father, military officer, and politician who served as the first president of the United States from 1789 to 1797. Appointed by the Second Continental Congress as commander of the Continental Army in 1775, Washington led Patriot forces to victory in the American Revolutionary War and then served as president of the Constitutional Convention in 1787, which drafted and ratified the Constitution of the United States and established the U.S. federal government. Washington has thus become commonly known as the ""Father of his Country""."
Marian Anderson,"Marian Anderson was an American contralto. She performed a wide range of music, from opera to spirituals. Anderson performed with renowned orchestras in major concert and recital venues throughout the United States and Europe between 1925 and 1965."
