Title,First Paragraph
Mahatma Gandhi,"Mohandas Karamchand Gandhi was an Indian lawyer, anti-colonial nationalist and political ethicist who employed nonviolent resistance to lead the successful campaign for India's independence from British rule. He inspired movements for civil rights and freedom across the world. The honorific Mahātmā, first applied to him in South Africa in 1914, is now used throughout the world."
Fred Astaire,"Fred Astaire was an American dancer, actor, singer, musician, choreographer, and presenter. He is widely regarded as the ""greatest popular-music dancer of all time"". He received numerous accolades including an Honorary Academy Award, three Primetime Emmy Awards, a BAFTA Award, two Golden Globe Awards, and a Grammy Award. He was honored with the Film Society of Lincoln Center tribute in 1973, the Kennedy Center Honors in 1978, and AFI Life Achievement Award in 1980. He was inducted into the Hollywood Walk of Fame in 1960, American Theatre Hall of Fame in 1972, and the Television Hall of Fame in 1989."
James Stewart,"James Maitland Stewart was an American actor and military officer. Known for his distinctive drawl and everyman screen persona, Stewart's film career spanned 80 films from 1935 to 1991. With the strong morality, which he portrayed both on and off the screen, he epitomized the ""American ideal"" in the mid-twentieth century. In 1999, the American Film Institute (AFI) ranked him third on its list of the greatest American male actors. He received numerous honors including the AFI Life Achievement Award in 1980, the Kennedy Center Honor in 1983, as well as the Academy Honorary Award and Presidential Medal of Freedom, both in 1985."
Jaroslav Seifert,"Jaroslav Seifert was a Czech writer, poet and journalist. Seifert was awarded the 1984 Nobel Prize in Literature ""for his poetry which endowed with freshness, sensuality and rich inventiveness provides a liberating image of the indomitable spirit and versatility of man""."
Ernest Borgnine,"Ernest Borgnine was an American actor whose career spanned over six decades. He was noted for his gruff but relaxed voice and gap-toothed Cheshire Cat grin. A popular performer, he also appeared as a guest on numerous talk shows and as a panelist on several game shows."
Diane Keaton,"Diane Keaton is an American actress. She has received various accolades throughout her career spanning over five decades, including an Academy Award, a British Academy Film Award, and two Golden Globe Awards, in addition to nominations for a Tony Award and two Emmy Awards. She was honored with the Film Society of Lincoln Center Gala Tribute in 2007 and an AFI Life Achievement Award in 2017."
Yul Brynner,"Yuliy Borisovich Briner, known professionally as Yul Brynner, was a Russian-born actor. He was known for his portrayal of King Mongkut in the Rodgers and Hammerstein stage musical The King and I, for which he won two Tony Awards, and later an Academy Award for Best Actor for the film adaptation. He played the role 4,625 times on stage and became known for his shaved head, which he maintained as a personal trademark long after adopting it for The King and I. Considered one of the first Russian-American film stars, he was honored with a ceremony to put his handprints in front of Grauman's Chinese Theatre in Hollywood in 1956, and also received a star on the Hollywood Walk of Fame in 1960."
Halle Berry,"Halle Maria Berry is an American actress. She began her career as a model and entered several beauty contests, finishing as the first runner-up in the Miss USA pageant and coming in sixth in the Miss World 1986. Her breakthrough film role was in the romantic comedy Boomerang (1992), alongside Eddie Murphy, which led to roles in The Flintstones (1994) and Bulworth (1998) as well as the television film Introducing Dorothy Dandridge (1999), for which she won a Primetime Emmy Award and a Golden Globe Award."
Charles Darwin,"Charles Robert Darwin was an English naturalist, geologist and biologist, widely known for his contributions to evolutionary biology. His proposition that all species of life have descended from a common ancestor is now generally accepted and considered a fundamental concept in science. In a joint publication with Alfred Russel Wallace, he introduced his scientific theory that this branching pattern of evolution resulted from a process he called natural selection, in which the struggle for existence has a similar effect to the artificial selection involved in selective breeding. Darwin has been described as one of the most influential figures in human history and was honoured by burial in Westminster Abbey."
Peter O'Toole,"Peter Seamus O'Toole was an English stage and film actor. He attended RADA and began working in the theatre, gaining recognition as a Shakespearean actor at the Bristol Old Vic and with the English Stage Company. In 1959 he made his West End debut in The Long and the Short and the Tall, and played the title role in Hamlet in the National Theatre's first production in 1963. Excelling on the London stage, O'Toole was known for his ""hellraiser"" lifestyle off it."
Alec Guinness,"Sir Alec Guinness was an English actor. After an early career on the stage, Guinness was featured in several of the Ealing comedies, including Kind Hearts and Coronets (1949), in which he played eight different characters, The Lavender Hill Mob (1951), for which he received his first Academy Award nomination, and The Ladykillers (1955). He collaborated six times with director David Lean: Herbert Pocket in Great Expectations (1946), Fagin in Oliver Twist (1948), Col. Nicholson in The Bridge on the River Kwai (1957), for which he won both the Academy Award for Best Actor and the BAFTA Award for Best Actor, Prince Faisal in Lawrence of Arabia (1962), General Yevgraf Zhivago in Doctor Zhivago (1965), and Professor Godbole in A Passage to India (1984). In 1970, he played Jacob Marley's ghost in Ronald Neame's Scrooge. He also portrayed Obi-Wan Kenobi in George Lucas's original Star Wars trilogy; for the original 1977 film, he was nominated for Best Supporting Actor at the 50th Academy Awards."
John McCain,"John Sidney McCain III was an American politician and United States Navy officer who served as a United States senator from Arizona from 1987 until his death in 2018. He previously served two terms in the United States House of Representatives and was the Republican nominee for president of the United States in the 2008 election, which he lost to Barack Obama."
Buster Keaton,"Joseph Frank ""Buster"" Keaton was an American actor, comedian and film director. He is best known for his silent films during the 1920s, in which he performed physical comedy and stunts with a stoic, deadpan expression that became his trademark and earned him the nickname ""The Great Stone Face"". Critic Roger Ebert wrote of Keaton's ""extraordinary period from 1920 to 1929"" when he ""worked without interruption"" as having made him ""the greatest actor-director in the history of the movies"". In 1996, Entertainment Weekly recognized Keaton as the seventh-greatest film director. and in 1999 the American Film Institute ranked him as the 21st-greatest male star of classic Hollywood cinema."
Sidney Poitier,"Sidney Poitier was a Bahamian and American actor, film director, and diplomat. In 1964, he was the first Black actor and first Bahamian to win the Academy Award for Best Actor. He received two competitive Golden Globe Awards, a BAFTA Award, and a Grammy Award as well as nominations for two Emmy Awards and a Tony Award. In 1999, he was ranked among the ""American Film Institute's 100 Stars"". 
Poitier was one of the last surviving stars from the Golden Age of Hollywood cinema."
Mary Pickford,"Gladys Louise Smith, known professionally as Mary Pickford, was a Canadian actress resident in the U.S., and also producer, screenwriter, and film studio founder, who was a pioneer in the US film industry with a Hollywood career that spanned five decades."
Lillian Gish,"Lillian Diana Gish was an American actress. Her film-acting career spanned 75 years, from 1912, in silent film shorts, to 1987. Gish was called the ""First Lady of American Cinema"", and is credited with pioneering fundamental film performance techniques. In 1999, the American Film Institute ranked Gish as the 17th greatest female movie star of Classic Hollywood cinema."
Carl Linnaeus,"Carl Linnaeus, also known after ennoblement in 1761 as Carl von Linné, was a Swedish biologist and physician who formalised binomial nomenclature, the modern system of naming organisms. He is known as the ""father of modern taxonomy"". Many of his writings were in Latin; his name is rendered in Latin as Carolus Linnæus and, after his 1761 ennoblement, as Carolus a Linné."
Harold Lloyd,"Harold Clayton Lloyd Sr. was an American actor, comedian, and stunt performer who appeared in many silent comedy films."
Adrien Brody,"Adrien Nicholas Brody is an American actor. He is known for his portrayal of Władysław Szpilman in Roman Polanski's war drama The Pianist (2002), for which he won the Academy Award for Best Actor at age 29, becoming the youngest actor to win in that category. He also became the second American male actor to win the César Award for Best Actor for the same film. He has starred in several other films and has received several other awards including nominations for a Golden Globe Award and a Primetime Emmy Award."
Jawaharlal Nehru,"Jawaharlal Nehru was an Indian anti-colonial nationalist, statesman, secular humanist, social democrat, and author who was a central figure in India during the middle of the 20th century. Nehru was a principal leader of the Indian nationalist movement in the 1930s and 1940s. Upon India's independence in 1947, he served as the country's first prime minister for 16 years. Nehru promoted parliamentary democracy, secularism, and science and technology during the 1950s, powerfully influencing India's arc as a modern nation. In international affairs, he steered India clear of the two blocs of the Cold War. A well-regarded author, his books written in prison, such as Letters from a Father to His Daughter (1929), An Autobiography (1936) and The Discovery of India (1946), have been read around the world."
Julius Caesar,"Gaius Julius Caesar was a Roman general and statesman. A member of the First Triumvirate, Caesar led the Roman armies in the Gallic Wars before defeating his political rival Pompey in a civil war, and subsequently became dictator from 49 BC until his assassination in 44 BC. He played a critical role in the events that led to the demise of the Roman Republic and the rise of the Roman Empire."
Holly Hunter,"Holly Hunter is an American actress. Hunter won the Academy Award for Best Actress for her performance as Ada McGrath in the 1993 drama film The Piano. She earned three additional Academy Award nominations for Broadcast News (1987), The Firm (1993), and Thirteen (2003). She won two Primetime Emmy Awards for Outstanding Lead Actress in a Limited Series or Movie for the television films Roe vs. Wade (1989) and The Positively True Adventures of the Alleged Texas Cheerleader-Murdering Mom (1993). She also starred in the TNT drama series Saving Grace (2007–2010)."
William Hurt,"William McChord Hurt was an American actor. He is widely known for his performances on stage and screen, he received various awards including an Academy Award, BAFTA Award, and Cannes Film Festival Award for Best Actor."
Simone Signoret,"Simone Signoret was a French actress. She received various accolades, including an Academy Award, three BAFTA Awards, a César Award, a Primetime Emmy Award, and the Cannes Film Festival Award for Best Actress, in addition to nominations for two Golden Globe Awards."
Jean-Paul Belmondo,"Jean-Paul Charles Belmondo was a French actor. Initially associated with the New Wave of the 1960s, he was a major French film star for several decades from the 1960s onward. His best known credits include Breathless (1960), That Man from Rio (1964), Pierrot le Fou (1965), Borsalino (1970), and The Professional (1981). He was most notable for portraying police officers in action thriller films and became known for his unwillingness to appear in English-language films despite being heavily courted by Hollywood. An undisputed box-office champion like Louis de Funès and Alain Delon of the same period, Belmondo attracted nearly 160 million spectators in his 50-year career. Between 1969 and 1982 he played four times in the most popular films of the year in France: The Brain (1969), Fear Over the City (1975), Animal (1977), Ace of Aces (1982), being surpassed on this point only by Louis de Funès. The popularity of Jean-Paul Belmondo as actor is mainly due to the characters he interpreted in his movies, loving to highlight the virile man, fighter, but also brave and heroic, which appealed to a wide audience in France and also abroad."
Alain Delon,"Alain Fabien Maurice Marcel Delon is a French actor, singer, filmmaker, and businessman. He was one of Europe's most prominent actors and screen sex symbols in the 1960s, 1970s and 1980s. In 1985, he won the César Award for Best Actor for his performance in Notre histoire (1984). In 1991, he became a member of France's Legion of Honour. At the 45th Berlin International Film Festival, he won the Honorary Golden Bear. At the 2019 Cannes Film Festival, he received the Honorary Palme d'Or."
Dante Alighieri,"Dante Alighieri, most likely baptized Durante di Alighiero degli Alighieri and often referred to as Dante, was a Florentine poet, writer, and philosopher. His Divine Comedy, originally called Comedìa and later christened Divina by Giovanni Boccaccio, is widely considered one of the most important poems of the Middle Ages and the greatest literary work in the Italian language."
Gregory Peck,"Eldred Gregory Peck was an American actor and one of the most popular film stars from the 1940s to the 1970s. In 1999, the American Film Institute named Peck the 12th-greatest male star of Classic Hollywood Cinema."
Carrie Fisher,"Carrie Frances Fisher was an American actress and writer. Fisher played Princess Leia in the original Star Wars films (1977–1983). She reprised the role in Star Wars: The Force Awakens (2015), The Last Jedi (2017) — a posthumous release that was dedicated to her — and appeared in The Rise of Skywalker (2019), through the use of unreleased footage from The Force Awakens."
Richard Mentor Johnson,"Richard Mentor Johnson was an American lawyer, military officer and politician who served as the ninth vice president of the United States, serving from 1837 to 1841 under President Martin Van Buren. He is the only vice president elected by the United States Senate under the provisions of the Twelfth Amendment. Johnson also represented Kentucky in the U.S. House of Representatives and Senate. He began and ended his political career in the Kentucky House of Representatives."
Mars Ravelo,"Marcial ""Mars"" Custodio Ravelo was a Filipino comic book cartoonist and graphic novelist. Dubbed as the ""King of Philippine Komiks"", he is notable for creating Darna, Dyesebel, Captain Barbell, Lastikman, Bondying, Varga, Wanted: Perfect Mother, Hiwaga, Maruja, Mariposa, Roberta, Rita, Buhay Pilipino, Jack and Jill, Flash Bomba, Tiny Tony, and Dragonna among others."
Tigran Sargsyan,"Tigran Sureni Sargsyan is an Armenian political figure who was Prime Minister of Armenia from 2008 to 2014. Previously he was Chairman of the Central Bank of Armenia from 1998 to 2008. After leaving office as prime minister, he served as ambassador to the United States from 2014 to 2016 and as chairman of the board of the Eurasian Economic Commission from 2016 to 2020."
Robert Blust,"Robert A. Blust was an American linguist who worked in several areas, including historical linguistics, lexicography and ethnology. He was Professor of Linguistics at the University of Hawaiʻi at Mānoa. Blust specialized in the Austronesian languages and made major contributions to the field of Austronesian linguistics."
Joanne Woodward,"Joanne Gignilliat Trimmier Woodward is an American retired actress. She made her career breakthrough in the 1950s and earned esteem and respect playing complex women with a characteristic nuance and depth of character. Her accolades include an Academy Award, three Primetime Emmy Awards, a British Academy Film Award, three Golden Globe Awards, and a Screen Actors Guild Award. She is the oldest living Best Actress Oscar-winner."
Nelson Rockefeller,"Nelson Aldrich Rockefeller, sometimes referred to by his nickname Rocky, was an American businessman and politician who served as the 41st vice president of the United States from 1974 to 1977 under President Gerald Ford. A member of the Republican Party and the wealthy Rockefeller family, he previously served as the 49th governor of New York from 1959 to 1973. Rockefeller also served as assistant secretary of State for American Republic Affairs for Presidents Franklin D. Roosevelt and Harry S. Truman (1944–1945) as well as under secretary of Health, Education and Welfare (HEW) under Dwight D. Eisenhower from 1953 to 1954. A son of John D. Rockefeller Jr. and Abby Aldrich Rockefeller as well as a grandson of Standard Oil co-founder John D. Rockefeller, he was a noted art collector and served as administrator of Rockefeller Center in Manhattan, New York City."
Bill Clinton,"William Jefferson Clinton is an American politician who served as the 42nd president of the United States from 1993 to 2001. A member of the Democratic Party, he previously served as Governor of Arkansas from 1979 to 1981 and again from 1983 to 1992. Clinton, whose policies reflected a centrist ""Third Way"" political philosophy, became known as a New Democrat."
Fidel Castro,"Fidel Alejandro Castro Ruz was a Cuban revolutionary and politician who was the leader of Cuba from 1959 to 2008, serving as the prime minister of Cuba from 1959 to 1976 and president from 1976 to 2008. Ideologically a Marxist–Leninist and Cuban nationalist, he also served as the first secretary of the Communist Party of Cuba from 1965 until 2011. Under his administration, Cuba became a one-party communist state; industry and business were nationalized, and socialist reforms were implemented throughout society."
Hector Berlioz,"Louis-Hector Berlioz was a French Romantic composer and conductor. His output includes orchestral works such as the Symphonie fantastique and Harold in Italy, choral pieces including the Requiem and L'Enfance du Christ, his three operas Benvenuto Cellini, Les Troyens and Béatrice et Bénédict, and works of hybrid genres such as the ""dramatic symphony"" Roméo et Juliette and the ""dramatic legend"" La Damnation de Faust."
Harry S. Truman,"Harry S. Truman was the 33rd president of the United States, serving from 1945 to 1953. A member of the Democratic Party, he previously served as a United States senator from Missouri from 1935 to 1945 and briefly as the 34th vice president in 1945 under Franklin D. Roosevelt. Assuming the presidency after Roosevelt's death, Truman implemented the Marshall Plan in the wake of World War II to rebuild the economy of Western Europe and established both the Truman Doctrine and NATO to contain the expansion of Soviet communism. He proposed numerous liberal domestic reforms, but few were enacted by the conservative coalition that dominated the Congress."
Judy Garland,"Judy Garland was an American actress and singer. She attained international stardom and critical acclaim: as an actress in both musical and dramatic roles; as a recording artist; and on the concert stage. Renowned for her versatility, she received a Golden Globe Award, a Special Tony Award and was one of twelve in history to receive an Academy Juvenile Award. Garland won the Grammy Award for Album of the Year for her 1961 live recording, Judy at Carnegie Hall; she was the first woman to win that award."
Robert Donat,"Friedrich Robert Donat was an English actor. He is best remembered for his roles in Alfred Hitchcock's The 39 Steps (1935) and Goodbye, Mr. Chips (1939), winning for the latter the Academy Award for Best Actor."
Ramon Magsaysay,"Ramon del Fierro Magsaysay was a Filipino statesman who served as the seventh President of the Philippines, from December 30, 1953, until his death in an aircraft disaster on March 17, 1957. An automobile mechanic by profession, Magsaysay was appointed military governor of Zambales after his outstanding service as a guerrilla leader during the Pacific War. He then served two terms as Liberal Party congressman for Zambales's at-large district before being appointed Secretary of National Defense by President Elpidio Quirino. He was elected president under the banner of the Nacionalista Party. He was the youngest to be elected as president, and second youngest to be president. He was the first Philippine president born in the 20th century and the first to be born after the Spanish colonial era."
John Adams,"John Adams was an American statesman, attorney, diplomat, writer, and Founding Father who served as the second president of the United States from 1797 to 1801. Before his presidency, he was a leader of the American Revolution that achieved independence from Great Britain. During the latter part of the Revolutionary War and in the early years of the new nation, he served the U.S. government as a senior diplomat in Europe. Adams was the first person to hold the office of vice president of the United States, serving from 1789 to 1797. He was a dedicated diarist and regularly corresponded with important contemporaries, including his wife and adviser Abigail Adams and his friend and political rival Thomas Jefferson."
Thomas Jefferson,"Thomas Jefferson was an American statesman, diplomat, lawyer, architect, philosopher, and Founding Father who served as the third president of the United States from 1801 to 1809. He was the primary author of the Declaration of Independence. Following the American Revolutionary War and prior to becoming president in 1801, Jefferson was the nation's first U.S. secretary of state under George Washington and then the nation's second vice president under John Adams."
James Madison,"James Madison was an American statesman, diplomat, and Founding Father who served as the fourth president of the United States from 1809 to 1817. Madison was popularly acclaimed the ""Father of the Constitution"" for his pivotal role in drafting and promoting the Constitution of the United States and the Bill of Rights."
James Monroe,"James Monroe was an American statesman, lawyer, diplomat, and Founding Father who served as the fifth president of the United States from 1817 to 1825, a member of the Democratic-Republican Party. He was the last Founding Father to serve as president as well as the last president of the Virginia dynasty. His presidency coincided with the Era of Good Feelings, concluding the First Party System era of American politics. He issued the Monroe Doctrine, a policy of limiting European colonialism in the Americas. Monroe previously served as governor of Virginia, a member of the United States Senate, U.S. ambassador to France and Britain, the seventh secretary of state, and the eighth secretary of war."
John Quincy Adams,"John Quincy Adams was an American statesman, politician, diplomat, lawyer, and diarist who served as the sixth president of the United States, from 1825 to 1829. He previously served as the eighth United States secretary of state from 1817 to 1825. During his long diplomatic and political career, Adams served as an ambassador and also as a member of the United States Congress representing Massachusetts in both chambers. He was the eldest son of John Adams, who served as the second president of the United States from 1797 to 1801, and First Lady Abigail Adams. Initially a Federalist like his father, he won election to the presidency as a member of the Democratic-Republican Party, and later, in the mid-1830s, became affiliated with the Whig Party."
Andrew Jackson,"Andrew Jackson was an American lawyer, planter, general, and statesman who served as the seventh president of the United States from 1829 to 1837. Before his presidency, he gained fame as a general in the U.S. Army and served in both houses of the U.S. Congress. Often praised as an advocate for ordinary Americans and for his work in preserving the union of states, Jackson has also been criticized for his racial policies, particularly his treatment of Native Americans."
Martin Van Buren,"Martin Van Buren was an American lawyer, diplomat, and statesman who served as the eighth president of the United States from 1837 to 1841. A primary founder of the Democratic Party, he served as New York's attorney general and U.S. senator, then briefly as the ninth governor of New York before joining Andrew Jackson's administration as the tenth United States secretary of state, minister to Great Britain, and ultimately the eighth vice president when named Jackson's running mate for the 1832 election. Van Buren won the presidency in 1836 against divided Whig opponents. Van Buren lost re-election in 1840, and failed to win the Democratic nomination in 1844. Later in his life, Van Buren emerged as an elder statesman and an important anti-slavery leader who led the Free Soil Party ticket in the 1848 presidential election."
