Title,First Paragraph
Toni Morrison,"Chloe Anthony Wofford Morrison, known as Toni Morrison, was an American novelist and editor. Her first novel, The Bluest Eye, was published in 1970. The critically acclaimed Song of Solomon (1977) brought her national attention and won the National Book Critics Circle Award. In 1988, Morrison won the Pulitzer Prize for Beloved (1987); she was awarded the Nobel Prize in Literature in 1993."
Sophocles,"Sophocles was an ancient Greek tragedian, known as one of three from whom at least one play has survived in full. His first plays were written later than, or contemporary with, those of Aeschylus; and earlier than, or contemporary with, those of Euripides. Sophocles wrote over 120 plays, but only seven have survived in a complete form: Ajax, Antigone, Women of Trachis, Oedipus Rex, Electra, Philoctetes, and Oedipus at Colonus. For almost fifty years, Sophocles was the most celebrated playwright in the dramatic competitions of the city-state of Athens which took place during the religious festivals of the Lenaea and the Dionysia. He competed in thirty competitions, won twenty-four, and was never judged lower than second place. Aeschylus won thirteen competitions, and was sometimes defeated by Sophocles; Euripides won four."
Rabindranath Tagore,"Rabindranath Tagore was an Indian poet, writer, playwright, composer, philosopher, social reformer, and painter during the age of Bengal Renaissance. He reshaped Bengali literature and music as well as Indian art with Contextual Modernism in the late 19th and early 20th centuries. Author of the ""profoundly sensitive, fresh and beautiful"" poetry of Gitanjali, he became in 1913 the first non-European and the first lyricist to win the Nobel Prize in Literature. Tagore's poetic songs were viewed as spiritual and mercurial; where his elegant prose and magical poetry were widely popular in the Indian subcontinent. He was a fellow of the Royal Asiatic Society. Referred to as ""the Bard of Bengal"", Tagore was known by sobriquets: Gurudeb, Kobiguru, and Biswokobi."
Leo Tolstoy,"Count Lev Nikolayevich Tolstoy, usually referred to in English as Leo Tolstoy, was a Russian writer. He is regarded as one of the greatest and most influential authors of all time. He received nominations for the Nobel Prize in Literature every year from 1902 to 1906 and for the Nobel Peace Prize in 1901, 1902, and 1909."
Mark Twain,"Samuel Langhorne Clemens, known by the pen name Mark Twain, was an American writer, humorist and essayist. He was praised as the ""greatest humorist the United States has produced,"" with William Faulkner calling him ""the father of American literature."" His novels include The Adventures of Tom Sawyer (1876) and its sequel, Adventures of Huckleberry Finn (1884), with the latter often called the ""Great American Novel."" Twain also wrote A Connecticut Yankee in King Arthur's Court (1889) and Pudd'nhead Wilson (1894), and co-wrote The Gilded Age: A Tale of Today (1873) with Charles Dudley Warner."
Alan Turing,"Alan Mathison Turing was an English mathematician, computer scientist, logician, cryptanalyst, philosopher and theoretical biologist. Turing was highly influential in the development of theoretical computer science, providing a formalisation of the concepts of algorithm and computation with the Turing machine, which can be considered a model of a general-purpose computer. He is widely considered to be the father of theoretical computer science and artificial intelligence."
Ernie Chan,"Ernesto Chan, born and sometimes credited as Ernie Chua, was a Filipino-American comics artist, known for work published by Marvel Comics and DC Comics, including many Marvel issues of series featuring Conan the Barbarian. Chan also had a long tenure on Batman and Detective Comics. Other than his work on Batman, Chan primarily focused on non-superhero characters, staying mostly in the genres of horror, war, and sword and sorcery."
Otto Dempwolff,"Otto Dempwolff was a German physician, linguist and anthropologist who specialized in the study of the Austronesian language family."
Ram Revilla,"Ram Revilla, born Ramgen Jose Magsaysay Bautista and also known as Ramgen Revilla, was a Filipino actor best known for his roles in various Filipino television series including his role as Jeff Gatdula in Tonyong Bayawak. Revilla was murdered on October 28, 2011. He was declared dead on arrival at the Parañaque Medical Center after being shot and stabbed in their family residence. There is no clear evidence about the gunman or the mastermind."
Johannes Brahms,"Johannes Brahms was a German composer, pianist, and conductor of the mid-Romantic period. Born in Hamburg into a Lutheran family, he spent much of his professional life in Vienna. He is sometimes grouped with Johann Sebastian Bach and Ludwig van Beethoven as one of the ""Three Bs"" of music, a comment originally made by the nineteenth-century conductor Hans von Bülow."
Antonín Dvořák,"Antonín Leopold Dvořák was a Czech composer. Dvořák frequently employed rhythms and other aspects of the folk music of Moravia and his native Bohemia, following the Romantic-era nationalist example of his predecessor Bedřich Smetana. Dvořák's style has been described as ""the fullest recreation of a national idiom with that of the symphonic tradition, absorbing folk influences and finding effective ways of using them,"" and he himself has been described as ""arguably the most versatile... composer of his time""."
Bing Crosby,"Harry Lillis ""Bing"" Crosby Jr. was an American singer, actor, television producer, television and radio personality and businessman. The first multimedia star, he was one of the most popular and influential musical artists of the 20th century worldwide. Crosby was a leader in record sales, network radio ratings, and motion picture grosses from 1926 to 1977. He was one of the first global cultural icons. Crosby made over 70 feature films and recorded more than 1,600 songs."
E. D. Merrill,"Elmer Drew ""E. D."" Merrill was an American botanist and taxonomist. He spent more than twenty years in the Philippines where he became a recognized authority on the flora of the Asia-Pacific region. Through the course of his career he authored nearly 500 publications, described approximately 3,000 new plant species, and amassed over one million herbarium specimens. In addition to his scientific work he was an accomplished administrator, college dean, university professor and editor of scientific journals."
George Frideric Handel,"George Frideric Handel was a German-British Baroque composer well known for his operas, oratorios, anthems, concerti grossi, and organ concertos. Handel received his training in Halle and worked as a composer in Hamburg and Italy before settling in London in 1712, where he spent the bulk of his career and became a naturalised British subject in 1727. He was strongly influenced both by the middle-German polyphonic choral tradition and by composers of the Italian Baroque. In turn, Handel's music forms one of the peaks of the ""high baroque"" style, bringing Italian opera to its highest development, creating the genres of English oratorio and organ concerto, and introducing a new style into English church music. He is consistently recognized as one of the greatest composers of his age."
Gustav Mahler,"Gustav Mahler was an Austro-Bohemian Romantic composer, and one of the leading conductors of his generation. As a composer he acted as a bridge between the 19th-century Austro-German tradition and the modernism of the early 20th century. While in his lifetime his status as a conductor was established beyond question, his own music gained wide popularity only after periods of relative neglect, which included a ban on its performance in much of Europe during the Nazi era. After 1945 his compositions were rediscovered by a new generation of listeners; Mahler then became one of the most frequently performed and recorded of all composers, a position he has sustained into the 21st century."
Gene Kelly,"Eugene Curran Kelly was an American dancer, actor, singer, director and choreographer. He was known for his energetic and athletic dancing style and sought to create a new form of American dance accessible to the general public, which he called ""dance for the common man"". He starred in, choreographed, and co-directed with Stanley Donen some of the most well-regarded musical films of the 1940s and 1950s."
Giacomo Puccini,"Giacomo Puccini was an Italian composer known primarily for his operas. Regarded as the greatest and most successful proponent of Italian opera after Verdi, he was descended from a long line of composers, stemming from the late-Baroque era. Though his early work was firmly rooted in traditional late-19th-century Romantic Italian opera, he later developed his work in the realistic verismo style, of which he became one of the leading exponents."
Franz Schubert,"Franz Peter Schubert was an Austrian composer of the late Classical and early Romantic eras. Despite his short life, Schubert left behind a vast oeuvre, including more than 600 secular vocal works, seven complete symphonies, sacred music, operas, incidental music, and a large body of piano and chamber music. His major works include the art songs ""Erlkönig"", ""Gretchen am Spinnrade"", ""Ave Maria""; the Trout Quintet, the unfinished Symphony No. 8 in B minor, the ""Great"" Symphony No. 9 in C major, the String Quartet No. 14 Death and the Maiden, a String Quintet, the two sets of Impromptus for solo piano, the three last piano sonatas, the Fantasia in F minor for piano four hands, the opera Fierrabras, the incidental music to the play Rosamunde, and the song cycles Die schöne Müllerin, Winterreise and Schwanengesang."
Igor Stravinsky,Igor Fyodorovich Stravinsky was a Russian composer and conductor with French citizenship and United States citizenship. He is widely considered one of the most important and influential composers of the 20th century and a pivotal figure in modernist music.
Pyotr Ilyich Tchaikovsky,"Pyotr Ilyich Tchaikovsky was a Russian composer of the Romantic period. He was the first Russian composer whose music would make a lasting impression internationally. Tchaikovsky wrote some of the most popular concert and theatrical music in the current classical repertoire, including the ballets Swan Lake and The Nutcracker, the 1812 Overture, his First Piano Concerto, Violin Concerto, the Romeo and Juliet Overture-Fantasy, several symphonies, and the opera Eugene Onegin."
Giuseppe Verdi,"Giuseppe Fortunino Francesco Verdi was an Italian composer best known for his operas. He was born near Busseto to a provincial family of moderate means, receiving a musical education with the help of a local patron, Antonio Barezzi. Verdi came to dominate the Italian opera scene after the era of Gioachino Rossini, Vincenzo Bellini, and Gaetano Donizetti, whose works significantly influenced him."
Reynaldo A. Duque,"Reynaldo A. Duque was a multilingual Ilocano writer who was the editor-in-chief of Liwayway magazine, the leading Filipino (Tagalog) weekly magazine in the Philippines. He was a fictionist, novelist, poet, playwright, radio/TV/movie scriptwriter, editor, and translator."
Jacques Cartier,"Jacques Cartier was a French-Breton maritime explorer for France. Jacques Cartier was the first European to describe and map the Gulf of Saint Lawrence and the shores of the Saint Lawrence River, which he named ""The Country of Canadas"" after the Iroquoian names for the two big settlements he saw at Stadacona and at Hochelaga."
Christopher Columbus,"Christopher Columbus was an Italian explorer and navigator from the Republic of Genoa who completed four Spanish-based voyages across the Atlantic Ocean sponsored by the Catholic Monarchs, opening the way for the widespread European exploration and European colonization of the Americas. His expeditions were the first known European contact with the Caribbean and Central and South America."
James Cook,"Captain James Cook was a British explorer, cartographer and naval officer famous for his three voyages between 1768 and 1779 in the Pacific Ocean and to New Zealand and Australia in particular. He made detailed maps of Newfoundland prior to making three voyages to the Pacific, during which he achieved the first recorded European contact with the eastern coastline of Australia and the Hawaiian Islands and the first recorded circumnavigation of New Zealand."
Hernán Cortés,"Hernán Cortés de Monroy y Pizarro Altamirano, 1st Marquess of the Valley of Oaxaca was a Spanish conquistador who led an expedition that caused the fall of the Aztec Empire and brought large portions of what is now mainland Mexico under the rule of the king of Castile in the early 16th century. Cortés was part of the generation of Spanish explorers and conquistadors who began the first phase of the Spanish colonization of the Americas."
Yuri Gagarin,"Yuri Alekseyevich Gagarin was a Soviet pilot and cosmonaut who, aboard the first successful crewed spaceflight, became the first human to journey into outer space. Travelling on Vostok 1, Gagarin completed one orbit of Earth on 12 April 1961, with his flight taking 108 minutes. By achieving this major milestone for the Soviet Union amidst the Space Race, he became an international celebrity and was awarded many medals and titles, including the nation's highest distinction: Hero of the Soviet Union."
Vasco da Gama,"Vasco da Gama, 1st Count of Vidigueira, was a Portuguese explorer and the first European to reach India by sea."
Ibn Battuta,"Abu Abdullah Muhammad ibn Battutah, commonly known as Ibn Battuta, was a Maghrebi traveller, explorer and scholar. Over a period of thirty years from 1325 to 1354, Ibn Battuta visited most of North Africa, the Middle East, East Africa, Central Asia, South Asia, Southeast Asia, China, the Iberian Peninsula, and West Africa. Near the end of his life, he dictated an account of his journeys, titled A Gift to Those Who Contemplate the Wonders of Cities and the Marvels of Travelling, but commonly known as The Rihla."
Zheng He,"Zheng He was a Chinese mariner, explorer, diplomat, fleet admiral, and court eunuch during the early Ming dynasty often regarded as the greatest admiral in Chinese history. He was originally born as Ma He in a Muslim family and later adopted the surname Zheng conferred by the Yongle Emperor. Commissioned by the Yongle Emperor and later the Xuande Emperor, Zheng commanded seven expeditionary treasure voyages to Southeast Asia, South Asia, West Asia, and East Africa from 1405 to 1433. According to legend, his larger ships carried hundreds of sailors on four decks and were almost twice as long as any wooden ship ever recorded."
Rio Diaz,"Rio Díaz Cojuangco, was a Filipino beauty queen, television presenter, actress and politician. The sister of former Miss Universe 1969 Gloria Díaz, she was diagnosed with stage four colon cancer and died in the United States in 2004. She was an aunt of Georgina Wilson, through another sister Aurora who is Wilson's mother."
Venus Raj,"Maria Venus Bayonito Raj-Orillan is a Filipino actress, model, and beauty pageant titleholder who was crowned Binibining Pilipinas Universe 2010. She represented the Philippines at the Miss Universe 2010 pageant and placed 4th Runner-up."
Joseph Haydn,"Franz Joseph Haydn was an Austrian composer of the Classical period. He was instrumental in the development of chamber music such as the string quartet and piano trio. His contributions to musical form have led him to be called ""Father of the Symphony"" and ""Father of the String quartet""."
Rommel Adducul,Rommel Adducul is a Filipino former professional basketball player who currently serves as an assistant coach for the Adamson Soaring Falcons of the UAAP.
Geoffrey Marcy,"Geoffrey William Marcy is an American astronomer. He was an early influence in the field of exoplanet detection, discovery, and characterization. Marcy was a professor of astronomy at the University of California, Berkeley, and an adjunct professor of physics and astronomy at San Francisco State University. Marcy and his research teams discovered many extrasolar planets, including 70 out of the first 100 known exoplanets and also the first planetary system around a Sun-like star, Upsilon Andromedae. Marcy was a co-investigator on the NASA Kepler mission. His collaborators have included R. Paul Butler, Debra Fischer and Steven S. Vogt, Jason Wright, Andrew Howard, Katie Peek, John Johnson, Erik Petigura, Lauren Weiss, Lea Hirsch and the Kepler Science Team. Following an investigation for sexual harassment in 2015, Marcy resigned his position at the University of California, Berkeley."
Jose Maria Sison,"Jose Maria Canlas Sison, also known as Joma, was a Filipino writer, poet, and activist who founded and led the Communist Party of the Philippines (CPP) and added elements of Maoism to its philosophy—which would be known as National Democracy. His ideology was formed by applying Marxism–Leninism–Maoism to the history and circumstances of the Philippines."
Federico Fellini,"Federico Fellini was an Italian filmmaker. He is known for his distinctive style, which blends fantasy and baroque images with earthiness. He is recognized as one of the greatest and most influential filmmakers of all time. His films have ranked highly in critical polls such as that of Cahiers du Cinéma and Sight & Sound, which lists his 1963 film 8+1⁄2 as the 10th-greatest film."
Roy V. Aragon,"Roy V. Aragon also known as Roy Vadil Aragon is a Filipino writer writing in the Ilokano and Filipino languages. He is a fictionist and poet, and also works as a translator, an editor, a book designer. Among his awards and prizes are three third-place prizes and one second-place prize in the Don Carlos Palanca Memorial Awards for Literature's short story contest in the Ilokano and Filipino divisions, received in 1999, 2001, 2014, and 2016, respectively. He has also won numerous prizes in Ilokano literary contests, such as the Gov. Roque Ablan Awards for Iloko Literature (GRAAFIL). He has published most of his short stories, poems, and feature articles in Bannawag, the leading Ilokano magazine in the Philippines."
Richard Stallman,"Richard Matthew Stallman, also known by his initials, rms, is an American free software movement activist and programmer. He campaigns for software to be distributed in such a manner that its users have the freedom to use, study, distribute, and modify that software. Software that ensures these freedoms is termed free software. Stallman launched the GNU Project, founded the Free Software Foundation (FSF) in October 1985, developed the GNU Compiler Collection and GNU Emacs, and wrote all versions of the GNU General Public License."
Ingmar Bergman,"Ernst Ingmar Bergman was a Swedish film and theatre director and screenwriter. Widely considered one of the greatest and most influential film directors of all time, his films have been described as ""profoundly personal meditations into the myriad struggles facing the psyche and the soul"". Some of his most acclaimed works include The Seventh Seal (1957), Wild Strawberries (1957), Persona (1966) and Fanny and Alexander (1982), which were included in the 2012 edition of Sight & Sound's Greatest Films of All Time. He was also ranked No. 8 on the magazine's 2002 ""Greatest Directors of All Time"" list."
Miguel Ángel Asturias,"Miguel Ángel Asturias Rosales was a Guatemalan poet-diplomat, novelist, playwright and journalist. Winning the Nobel Prize in Literature in 1967, his work helped bring attention to the importance of indigenous cultures, especially those of his native Guatemala."
Isaac Bashevis Singer,"Isaac Bashevis Singer was a Polish-born Jewish-American novelist, short-story writer, memoirist, essayist, and translator. Some of his works were adapted for the theater. He wrote and published first in Yiddish and later translated his own works into English with the help of editors and collaborators. He was awarded the Nobel Prize for Literature in 1978. A leading figure in the Yiddish literary movement, he was awarded two U.S. National Book Awards, one in Children's Literature for his memoir A Day of Pleasure: Stories of a Boy Growing Up in Warsaw (1970) and one in Fiction for his collection A Crown of Feathers and Other Stories (1974)."
Sonny Cabatu,"Santiago ""Sonny"" Cabatu Sr. is a Filipino retired professional basketball player in the Philippine Basketball Association and was the first draft pick of the league in 1985. He is also the father of current Philippine Patriots player Junjun Cabatu. He also played for the Cagayan de Oro Nuggets and Pasig-Rizal Pirates in the Metropolitan Basketball Association."
Clara Zetkin,"Clara Zetkin was a German Marxist theorist, communist activist, and advocate for women's rights."
Barack Obama,"Barack Hussein Obama II is an American politician who served as the 44th president of the United States from 2009 to 2017. A member of the Democratic Party, he was the first African-American president in U.S. history. Obama previously served as a U.S. senator representing Illinois from 2005 to 2008, as an Illinois state senator from 1997 to 2004, and as a civil rights lawyer and university lecturer."
Leonhard Euler,"Leonhard Euler was a Swiss mathematician, physicist, astronomer, geographer, logician, and engineer who founded the studies of graph theory and topology and made pioneering and influential discoveries in many other branches of mathematics such as analytic number theory, complex analysis, and infinitesimal calculus. He introduced much of modern mathematical terminology and notation, including the notion of a mathematical function. He is also known for his work in mechanics, fluid dynamics, optics, astronomy, and music theory."
Megawati Sukarnoputri,Diah Permata Megawati Setiawati Sukarnoputri is an Indonesian politician who served as the fifth president of Indonesia from 2001 to 2004. She previously served as the eighth vice president from 1999 to 2001.
Leonardo da Vinci,"Leonardo di ser Piero da Vinci was an Italian polymath of the High Renaissance who was active as a painter, draughtsman, engineer, scientist, theorist, sculptor, and architect. While his fame initially rested on his achievements as a painter, he has also become known for his notebooks, in which he made drawings and notes on a variety of subjects, including anatomy, astronomy, botany, cartography, painting, and paleontology. Leonardo is widely regarded to have been a genius who epitomized the Renaissance humanist ideal, and his collective works comprise a contribution to later generations of artists matched only by that of his younger contemporary Michelangelo."
Rainer Maria Rilke,"René Karl Wilhelm Johann Josef Maria Rilke, known as Rainer Maria Rilke, was an Austrian poet and novelist. Acclaimed as an idiosyncratic and expressive poet, he is widely recognized as a significant writer in the German language. His work is viewed by critics and scholars as possessing undertones of mysticism, exploring themes of subjective experience and disbelief. His writings include one novel, several collections of poetry and several volumes of correspondence."
Paul Heyse,"Paul Johann Ludwig von Heyse was a distinguished German writer and translator. A member of two important literary societies, the Tunnel über der Spree in Berlin and Die Krokodile in Munich, he wrote novels, poetry, 177 short stories, and about sixty dramas. The sum of Heyse's many and varied productions made him a dominant figure among German men of letters. He was awarded the 1910 Nobel Prize in Literature ""as a tribute to the consummate artistry, permeated with idealism, which he has demonstrated during his long productive career as a lyric poet, dramatist, novelist and writer of world-renowned short stories."" Wirsen, one of the Nobel judges, said that ""Germany has not had a greater literary genius since Goethe."" Heyse is the fifth oldest laureate in literature, after Alice Munro, Jaroslav Seifert, Theodor Mommsen and Doris Lessing."
Dario Fo,"Dario Luigi Angelo Fo was an Italian playwright, actor, theatre director, stage designer, songwriter, political campaigner for the Italian left wing and the recipient of the 1997 Nobel Prize in Literature. In his time he was ""arguably the most widely performed contemporary playwright in world theatre"". Much of his dramatic work depends on improvisation and comprises the recovery of ""illegitimate"" forms of theatre, such as those performed by giullari and, more famously, the ancient Italian style of commedia dell'arte."
Lee Marvin,"Lee Marvin was an American film and television actor. Known for his bass voice and premature white hair, he is best remembered for playing hardboiled ""tough guy"" characters. Although initially typecast as the ""heavy"", he later gained prominence for portraying anti-heroes, such as Detective Lieutenant Frank Ballinger on the television series M Squad (1957–1960). Marvin's notable roles in film included Charlie Strom in The Killers (1964), Rico Fardan in The Professionals (1966), Major John Reisman in The Dirty Dozen (1967), Ben Rumson in Paint Your Wagon (1969), Walker in Point Blank (1967), and the Sergeant in The Big Red One (1980)."
Emil Jannings,"Emil Jannings was a Swiss-born German actor who was popular in Hollywood in the 1920s. He was the first recipient of the Academy Award for Best Actor for his roles in The Last Command and The Way of All Flesh. As of 2024, Jannings is the only German ever to have won the category."
