Title,First Paragraph
Strike Revilla,Strike Bautista Revilla is a Filipino politician and incumbent Representative of Cavite's 2nd District in the Philippine House of Representatives. He is a member of the National Unity Party. He previously served as mayor of Bacoor and was a member of the board of directors of the Philippine Charity Sweepstakes Office (PCSO) from August 2005 to March 2007.
Carla Abellana,"Carla Angeline Reyes Abellana is a Filipino actress and model. She played the lead role in the Philippine adaptation of the Mexican telenovela Rosalinda, and is also known for other leading roles in Sine Novela: Basahang Ginto in 2010, Kung Aagawin Mo Ang Langit in 2011, Makapiling Kang Muli in 2012, My Husband's Lover in 2013, My Destiny in 2014, Because of You in 2015, Mulawin vs. Ravena, and I Heart Davao in 2017. Her first anti-heroine role was in Pamilya Roces in 2018, and followed it up with the family-oriented drama Love of My Life in 2020. In 2023, she starred in Stolen Life as a wife who switched places with her cousin, turning to a villainous role for the first time in her career. She is currently an exclusive artist of under Triple A Management and exclusive talent of GMA Network."
Alfredo Alcala,"Alfredo P. Alcala was a Filipino comics artist, born in Talisay, Negros Occidental in the Philippines. Alcala was an established illustrator whose works appeared in the Alcala Komix Magazine. His 1963 creation Voltar introduced him to an international audience, particularly in the United States. Alcala garnered awards in science fiction during the early part of the 1970s."
Albert Garcia,"Albert Raymond ""Abet"" Sandejas Garcia is a Filipino politician. He currently serves as a member of the Philippine House of Representatives representing the 2nd District of Bataan since 2022. He served as the 24th provincial Governor of Bataan from 2013 to 2022 under the National Unity Party, which also he is the president of the political party. He has previously been elected to two terms as a Member of the House of Representatives, representing the 2nd District of Bataan. He first won election to Congress in 2004 and was re-elected in 2007. Prior to his election to Congress, Garcia served two terms as mayor of Balanga from 1998 to 2004."
Felicito Payumo,"Felicito Payumo is a Filipino businessman and politician currently serving as chairman of University of Nueva Caceres–Bataan. He represented the First District of Bataan in the House of Representatives of the Philippines from 1987 to 1998, and served as chairman of the Subic Bay Metropolitan Authority from 1998 to 2004 and Bases Conversion and Development Authority from 2011 to 2012, respectively."
Katrina Halili,"Maria Katrina Iren Pe Halili is a Filipino actress and commercial model of Chinese descent. She made her screen debut in 2003 through the reality talent competition StarStruck, and became a household name for playing antagonist roles in several hit television series, the most prominent being Majika (2006), Marimar (2007) and Darna."
Mauricio Domogan,"Mauricio ""Morris"" Gamsao Domogan is a Filipino lawyer and politician and is the longest serving mayor of the city of Baguio. A member of the Lakas Kampi CMD party, Domogan served three terms as mayor of Baguio, initially as acting mayor from July to October 1992, and officially as the new mayor in October 1992 after succeeding the mayoralty post from Ramon Labo after he was disqualified due to his citizenship status, until 2001, and again from 2010 to 2019."
Paul Cézanne,Paul Cézanne was a French Post-Impressionist painter whose work introduced new modes of representation and influenced avant-garde artistic movements of the early 20th century. Cézanne is said to have formed the bridge between late 19th-century Impressionism and early 20th century Cubism.
William Howard Taft,"William Howard Taft was the 27th president of the United States, serving from 1909 to 1913, and the tenth chief justice of the United States, serving from 1921 to 1930, the only person to have held both offices. Taft was elected president in 1908, the chosen successor of Theodore Roosevelt, but was defeated for reelection in 1912 by Woodrow Wilson after Roosevelt split the Republican vote by running as a third-party candidate. In 1921, President Warren G. Harding appointed Taft to be chief justice, a position he held until a month before his death."
Benjamin Harrison,"Benjamin Harrison was an American politician who served as the 23rd president of the United States from 1889 to 1893. He was a member of the Harrison family of Virginia—a grandson of the ninth president, William Henry Harrison, and a great-grandson of Benjamin Harrison V, a Founding Father."
Rutherford B. Hayes,"Rutherford Birchard Hayes was an American military officer and politician from the state of Ohio. A Republican, Hayes served as the 19th president of the United States from 1877 to 1881."
T-Bone Walker,"Aaron Thibeaux ""T-Bone"" Walker was an American blues musician, composer, songwriter and bandleader, who was a pioneer and innovator of the jump blues, West Coast blues, and electric blues sounds. In 2018 Rolling Stone magazine ranked him number 67 on its list of ""The 100 Greatest Guitarists of All Time""."
Emmy Rossum,"Emmanuelle Grey Rossum is an American actress, director, producer, singer, and songwriter. She is best known for her portrayal of Fiona Gallagher in the television series Shameless (2011–2019). Since the mid-2010s, she has directed and produced television, including the 2022 Peacock series Angelyne in which she also stars."
Jose P. Laurel,"José Paciano Laurel y García was a Filipino politician, lawyer, and judge, who served as the President of the Japanese-occupied Second Philippine Republic, a puppet state during World War II, from 1943 to 1945. Since the administration of President Diosdado Macapagal (1961–1965), Laurel has been officially recognized by later administrations as a former president of the Philippines."
Calvin Coolidge,Calvin Coolidge was an American attorney and politician who served as the 30th president of the United States from 1923 to 1929.
Boris Christoff,"Boris Christoff was a Bulgarian opera singer, widely considered one of the greatest basses of the 20th century."
Brigitte Bardot,"Brigitte Anne-Marie Bardot, often referred to by her initials B.B., is a French animal rights activist and former actress, singer, and model. Famous for portraying sexually emancipated characters, often with hedonistic lifestyles, she was one of the best known activists in the sexual revolution of the 1950s–1970s. Although she withdrew from the entertainment industry in 1973, she remains a major popular culture icon and a noted figure in ushering in the sexual revolution. She has acted in 47 films, performed in several musicals, and recorded more than 60 songs. She was awarded the Legion of Honour in 1985."
Guglielmo Marconi,"Guglielmo Giovanni Maria Marconi, 1st Marquis of Marconi was an Italian inventor and electrical engineer, known for his creation of a practical radio wave–based wireless telegraph system. This led to Marconi being credited as the inventor of radio, and he shared the 1909 Nobel Prize in Physics with Karl Ferdinand Braun ""in recognition of their contributions to the development of wireless telegraphy""."
Robert De Niro,"Robert Anthony De Niro is an American actor and film producer. Known for his collaborations with Martin Scorsese, he is considered to be one of the greatest and most influential actors of his generation. De Niro is the recipient of various accolades, including two Academy Awards, a Golden Globe Award, the Cecil B. DeMille Award, and a Screen Actors Guild Life Achievement Award. In 2009, De Niro received the Kennedy Center Honors, and earned a Presidential Medal of Freedom from U.S. President Barack Obama in 2016."
Lorenzo Ruiz,"Lorenzo Ruiz, also called Saint Lorenzo of Manila, is a Filipino saint venerated in the Catholic Church. A Chinese Filipino, he became his country's protomartyr after his execution in Japan by the Tokugawa Shogunate during its persecution of Japanese Christians in the 17th century."
Toshiro Mifune,"Toshiro Mifune  was a Japanese actor and producer. A winner of numerous awards and accolades over a lengthy career, Mifune is best known for starring in Akira Kurosawa's critically-acclaimed jidaigeki films such as Rashomon (1950), Seven Samurai (1954), Throne of Blood (1957), The Hidden Fortress (1958) and Yojimbo (1961). He also portrayed Miyamoto Musashi in Hiroshi Inagaki's Samurai Trilogy (1954–1956), Lord Toranaga in the NBC television miniseries Shōgun, and Admiral Isoroku Yamamoto in three different films. He is widely considered one of the greatest actors of all time."
Thomas Mann,"Paul Thomas Mann was a German novelist, short story writer, social critic, philanthropist, essayist, and the 1929 Nobel Prize in Literature laureate. His highly symbolic and ironic epic novels and novellas are noted for their insight into the psychology of the artist and the intellectual. His analysis and critique of the European and German soul used modernized versions of German and Biblical stories, as well as the ideas of Johann Wolfgang von Goethe, Friedrich Nietzsche, and Arthur Schopenhauer."
José Saramago,"José de Sousa Saramago was a Portuguese writer. He was the recipient of the 1998 Nobel Prize in Literature for his ""parables sustained by imagination, compassion and irony [with which he] continually enables us once again to apprehend an elusory reality."" His works, some of which can be seen as allegories, commonly present subversive perspectives on historic events, emphasizing the theopoetic human factor. In 2003 Harold Bloom described Saramago as ""the most gifted novelist alive in the world today"" and in 2010 said he considers Saramago to be ""a permanent part of the Western canon"", while James Wood praises ""the distinctive tone to his fiction because he narrates his novels as if he were someone both wise and ignorant."""
Samuel Beckett,"Samuel Barclay Beckett was an Irish novelist, dramatist, short story writer, theatre director, poet, and literary translator. His literary and theatrical work features bleak, impersonal, and tragicomic experiences of life, often coupled with black comedy and nonsense. His work became increasingly minimalist as his career progressed, involving more aesthetic and linguistic experimentation, with techniques of stream of consciousness repetition and self-reference. He is considered one of the last modernist writers, and one of the key figures in what Martin Esslin called the Theatre of the Absurd."
Betty White,"Betty Marion Ludden was an American actress, comedian and producer. A pioneer of early television with a career spanning almost seven decades, she was noted for her vast number of television appearances acting in sitcoms, sketch comedy, and game shows. She produced and starred in the series Life with Elizabeth (1953–1955), thus becoming the first woman to produce a sitcom."
Nicole Kidman,"Nicole Mary Kidman is an Australian and American actress and producer. Known for her work in film and television productions across many genres, she has consistently ranked among the world's highest-paid actresses. She is the recipient of numerous accolades, including an Academy Award, a BAFTA Award, two Primetime Emmy Awards, and six Golden Globe Awards. She received the New York Film Festival Gala Tribute in 2012 and is the first Australian actor to receive the AFI Life Achievement Award honor."
Pierre Curie,"Pierre Curie was a French physicist, a pioneer in crystallography, magnetism, piezoelectricity, and radioactivity. In 1903, he received the Nobel Prize in Physics with his wife, Marie Skłodowska–Curie, and Henri Becquerel, ""in recognition of the extraordinary services they have rendered by their joint researches on the radiation phenomena discovered by Professor Henri Becquerel"". With their win, the Curies became the first ever married couple to win the Nobel Prize, launching the Curie family legacy of five Nobel Prizes."
Luciano Pavarotti,"Luciano Pavarotti was an Italian operatic tenor who during the late part of his career crossed over into popular music, eventually becoming one of the most acclaimed tenors of all time. He made numerous recordings of complete operas and individual arias, gaining worldwide fame for his tone, and gaining the nickname ""King of the High Cs""."
Mikhail Ulyanov,"Mikhail Ulyanov may refer to:Mikhail Alexandrovich Ulyanov, actor
Mikhail Ivanovich Ulyanov, diplomat

"
T. S. Eliot,"Thomas Stearns Eliot  was a poet, essayist, publisher, playwright, literary critic and editor. He is considered to be one of the 20th century's greatest poets, as well as a central figure in English-language Modernist poetry. His use of language, writing style, and verse structure reinvigorated English poetry. He is also noted for his critical essays, which often reevaluated long-held cultural beliefs."
Natalie Portman,"Natalie Portman is an Israeli-born American actress. She has had a prolific film career since her teenage years and has starred in various blockbusters and independent films, receiving multiple accolades, including an Academy Award and two Golden Globe Awards."
Masiela Lusha,"Masiela Lusha is an Albanian-born American actress and author. She gained recognition for playing Carmen Lopez on the globally syndicated ABC sitcom George Lopez, a role that earned her two consecutive Young Artist Awards for Leading Young Actress in a Comedy or Drama. After transitioning into film, she starred in Sony Pictures’ Blood: The Last Vampire. Lusha also starred alongside David Hasselhoff and Ian Ziering in SyFy's television movie Sharknado: The 4th Awakens."
Gregor Mendel,"Gregor Johann Mendel OSA was an Austrian-Czech biologist, meteorologist, mathematician, Augustinian friar and abbot of St. Thomas' Abbey in Brno (Brünn), Margraviate of Moravia. Mendel was born in a German-speaking family in the Silesian part of the Austrian Empire and gained posthumous recognition as the founder of the modern science of genetics. Though farmers had known for millennia that crossbreeding of animals and plants could favor certain desirable traits, Mendel's pea plant experiments conducted between 1856 and 1863 established many of the rules of heredity, now referred to as the laws of Mendelian inheritance."
Jejomar Binay,"Jejomar ""Jojo"" Cabauatan Binay Sr. is a Filipino lawyer and politician who served as the 13th vice president of the Philippines from 2010 to 2016, under President Benigno Aquino III."
Innokenty Smoktunovsky,Innokenty Mikhailovich Smoktunovsky was a Soviet and Russian stage and film actor. He was named a People's Artist of the USSR in 1974 and a Hero of Socialist Labour in 1990.
Herta Müller,"Herta Müller is a Romanian-German novelist, poet, essayist and recipient of the 2009 Nobel Prize in Literature. She was born in Nițchidorf, Timiș County in Romania; her native language is German. Since the early 1990s, she has been internationally established, and her works have been translated into more than twenty languages."
Betty Gofman,"Betty Gofman is a Brazilian stage, film, and television actress. Descended from Russian-Austrian Jews, she is married to philosopher Hugo Barreto, with whom she has two daughters, the twins Alice and Helena, and she is the sister of actress Rosane (Roxanne) Gofman."
Leonardo DiCaprio,"Leonardo Wilhelm DiCaprio is an American actor and film producer. Known for his work in biographical and period films, he is the recipient of numerous accolades, including an Academy Award, a British Academy Film Award, and three Golden Globe Awards. As of 2019, his films have grossed over $7.2 billion worldwide, and he has been placed eight times in annual rankings of the world's highest-paid actors."
Ramón Menéndez Pidal,"Ramón Menéndez Pidal was a Spanish philologist and historian. He worked extensively on the history of the Spanish language and Spanish folklore and folk poetry. One of his main topics was the history and legend of El Cid. He was nominated for the Nobel Prize in 26 separate years, the most nominations of any other person."
George Lucas,"George Walton Lucas Jr. is an American filmmaker and philanthropist. Lucas is best known for creating the Star Wars and Indiana Jones franchises and founding Lucasfilm, LucasArts, Industrial Light & Magic and THX. He served as chairman of Lucasfilm, before selling it to The Walt Disney Company in 2012. Lucas is one of history's most financially successful filmmakers and has been nominated for four Academy Awards. Lucas personally directed or conceived ten of the 100 highest-grossing movies at the North American box office, adjusted for ticket-price inflation. Lucas is considered to be one of the most significant figures of the 20th-century New Hollywood movement, and a pioneer of the modern blockbuster. Despite this, he has remained an independent filmmaker away from Hollywood for most of his career."
Basshunter,"Jonas Erik Altberg, known professionally as Basshunter, is a Swedish singer, record producer, songwriter and DJ. As indicated by his stage name, Basshunter is known for bass-heavy eurodance, trance, and electronic pop music."
William Faulkner,"William Cuthbert Faulkner was an American writer known for his novels and short stories set in the fictional Yoknapatawpha County, based on Lafayette County, Mississippi, where Faulkner spent most of his life. A Nobel laureate, Faulkner is one of the most celebrated writers of American literature and often is considered the greatest writer of Southern literature."
Jo Jung-suk,"Jo Jung-suk is a South Korean actor. He began his career in theater, starring in Spring Awakening, Hedwig and the Angry Inch, and the stage adaptation of The Harmonium in My Memory, among many other musicals and plays."
Bob Dylan,"Bob Dylan is an American singer-songwriter. Often considered to be one of the greatest songwriters in history, Dylan has been a major figure in popular culture over his 60-year career. He rose to prominence in the 1960s, when his songs ""Blowin' in the Wind"" (1963) and ""The Times They Are a-Changin'"" (1964) became anthems for the civil rights and antiwar movements. Initially modeling his style on Woody Guthrie's folk songs, Robert Johnson's blues, and what he called the ""architectural forms"" of Hank Williams's country songs, Dylan added increasingly sophisticated lyrical techniques to the folk music of the early 1960s, infusing it ""with the intellectualism of classic literature and poetry"". His lyrics incorporated political, social, and philosophical influences, defying pop music conventions and appealing to the burgeoning counterculture."
John Steinbeck,"John Ernst Steinbeck was an American writer. He won the 1962 Nobel Prize in Literature ""for his realistic and imaginative writings, combining as they do sympathetic humor and keen social perception"". He has been called ""a giant of American letters."""
Grace Kelly,"Grace Patricia Kelly, also known as Grace of Monaco, was an American actress and Princess of Monaco as the wife of Prince Rainier III from their marriage on April 18, 1956, until her death. Prior to her marriage, she starred in several significant films in the early to mid-1950s. She received an Academy Award, three Golden Globe Awards and was ranked 13th on the American Film Institute's 25 Greatest Female Stars list."
Penélope Cruz,"Penélope Cruz Sánchez is a Spanish actress. Prolific in Spanish and English-language films, she has received various accolades, including an Academy Award and a BAFTA Award, in addition to nominations for a Primetime Emmy Award and four Golden Globe Awards."
Jack Nicholson,"John Joseph Nicholson is an American retired actor and filmmaker. Nicholson is widely regarded as one of the greatest actors of the 20th century. Throughout his five-decade career he received numerous accolades, including three Academy Awards, three BAFTA Film Awards, six Golden Globe Awards, and a Grammy Award. He also received the American Film Institute's Life Achievement Award in 1994 and the Kennedy Center Honor in 2001. In many of his films, he played rebels against the social structure."
Mario Vargas Llosa,"Jorge Mario Pedro Vargas Llosa, 1st Marquess of Vargas Llosa, more commonly known as Mario Vargas Llosa, is a Peruvian novelist, journalist, essayist and former politician. Vargas Llosa is one of Latin America's most significant novelists and essayists and one of the leading writers of his generation. Some critics consider him to have had a larger international impact and worldwide audience than any other writer of the Latin American Boom. In 2010, he won the Nobel Prize in Literature, ""for his cartography of structures of power and his trenchant images of the individual's resistance, revolt, and defeat."" He also won the 1967 Rómulo Gallegos Prize, the 1986 Prince of Asturias Award, the 1994 Miguel de Cervantes Prize, the 1995 Jerusalem Prize, the 2012 Carlos Fuentes International Prize, and the 2018 Pablo Neruda Order of Artistic and Cultural Merit. In 2021, he was elected to the Académie française."
W. B. Yeats,"William Butler Yeats was an Irish poet, dramatist and writer, and one of the foremost figures of 20th-century literature. He was a driving force behind the Irish Literary Revival, and along with Lady Gregory founded the Abbey Theatre, serving as its chief during its early years. He was awarded the 1923 Nobel Prize in Literature, and later served two terms as a Senator of the Irish Free State."
Joan Crawford,"Joan Crawford was an American actress. She started her career as a dancer in traveling theatrical companies before debuting on Broadway. Crawford was signed to a motion picture contract by Metro-Goldwyn-Mayer in 1925. Initially frustrated by the size and quality of her parts, Crawford launched a publicity campaign and built an image as a nationally known flapper by the end of the 1920s. By the 1930s, Crawford's fame rivaled MGM colleagues Norma Shearer and Greta Garbo. Crawford often played hardworking young women who find romance and financial success. These ""rags-to-riches"" stories were well received by Depression-era audiences and were popular with women. Crawford became one of Hollywood's most prominent movie stars and one of the highest paid women in the United States, but her films began losing money. By the end of the 1930s, she was labeled ""box office poison""."
Julia Roberts,"Julia Fiona Roberts is an American actress. Known for her leading roles in films encompassing a variety of genres, she has received multiple accolades, including an Academy Award, a British Academy Film Award, and three Golden Globe Awards. The films in which she has starred have collectively grossed over $3.9 billion globally, making her one of Hollywood's most bankable stars. After an early breakthrough with appearances in Mystic Pizza (1988) and Steel Magnolias (1989), Roberts established herself as a leading actress when she headlined the top-grossing romantic comedy Pretty Woman (1990)."
John Wayne,"Marion Robert Morrison, professionally known as John Wayne and nicknamed ""the Duke"" or ""Duke Wayne"", was an American actor who became a popular icon through his starring roles in films which were produced during Hollywood's Golden Age, especially in Western and war movies. His career flourished from the silent era of the 1920s through the American New Wave, as he appeared in a total of 179 film and television productions. He was among the top box-office draws for three decades and appeared with many other important Hollywood stars of his era. In 1999, the American Film Institute selected Wayne as one of the greatest male stars of classic American cinema."
Sandra Bullock,"Sandra Annette Bullock is an American actress and film producer. She has received several awards and nominations, including an Academy Award and a Golden Globe Award. She was the world's highest-paid actress in 2010 and 2014, and was named one of Time's 100 most influential people in the world in 2010."
Knut Hamsun,"Knut Hamsun was a Norwegian writer who was awarded the Nobel Prize in Literature in 1920. Hamsun's work spans more than 70 years and shows variation with regard to consciousness, subject, perspective and environment. He published more than 23 novels, a collection of poetry, some short stories and plays, a travelogue, works of non-fiction and some essays."
Doris Lessing,"Doris May Lessing was a British novelist. She was born to British parents in Iran, where she lived until 1925. Her family then moved to Southern Rhodesia, where she remained until moving in 1949 to London, England. Her novels include The Grass Is Singing (1950), the sequence of five novels collectively called Children of Violence (1952–1969), The Golden Notebook (1962), The Good Terrorist (1985), and five novels collectively known as Canopus in Argos: Archives (1979–1983)."
Werner Heisenberg,"Werner Karl Heisenberg was a German theoretical physicist, one of the main pioneers of the theory of quantum mechanics, and a principal scientist in the Nazi nuclear weapons program during World War II. He published his Umdeutung paper in 1925, a major reinterpretation of old quantum theory. In the subsequent series of papers with Max Born and Pascual Jordan, during the same year, his matrix formulation of quantum mechanics was substantially elaborated. He is known for the uncertainty principle, which he published in 1927. Heisenberg was awarded the 1932 Nobel Prize in Physics ""for the creation of quantum mechanics""."
